scraped_at,platform,app_id,app_name,app_priority,review_id,author,rating,review_text,thumbs_up,review_date,app_version,reply_text,reply_date
2026-04-17T21:41:13.891822+00:00,google_play,io.zimran.coursiv,Coursiv,primary,51932406-5476-45dc-8319-4aa670819dc1,Shannon Howard,5,"Great app. Only one thing for improvement, when I create my Bots in the ChatGPT 2.0 it would be nice to use the Bot in a workflow. Maybe something Coursiv can generate inside of the Playground feature.",0,2026-02-03 17:24:48,2.0.4,"Thank you for your fantastic feedback! We're glad you enjoy the app. Your suggestion about integrating Bots into workflows in the Playground feature is invaluable for enhancing user experience. If you have more ideas or need support, don’t hesitate to reach out. Best regards, Coursiv Team🚀",2026-02-03 17:28:52
2026-04-17T21:41:13.891827+00:00,google_play,io.zimran.coursiv,Coursiv,primary,0537bba6-10b7-4cb1-b1d5-b3263de08ddd,Jaime Hao,5,Just had 2 lessons and I absolutely love it. I am starting to understand the power of AI in improving people's daily tasks. Looking forward to more lessons!,1,2026-02-05 13:00:31,2.0.4,"Hi there! It's fantastic to hear that you're enjoying the lessons and discovering the influence of AI on daily tasks! We're grateful for your enthusiasm and support. If you have any questions or need further assistance, feel free to reach out. Keep up the great work as you continue your learning journey! Best regards, Coursiv Team🚀",2026-02-05 13:03:25
2026-04-17T21:41:13.891831+00:00,google_play,io.zimran.coursiv,Coursiv,primary,784069d6-b60b-4f51-b175-97da9ececc34,Brenda Mattison,5,Coursiv has a great ease in the way that AI is taught on their platform. You walk away after a lesson with assurance and capabilities that prepare you with sound strength to master the world of future technologies. I am so happy that I took the first steps to growing with AI an unending experience.,1,2026-01-27 03:49:18,2.0.1,"Brenda Mattison, thank you for your enthusiastic feedback! It's fantastic to see how the lessons are boosting your confidence and skills in AI. Your growth in this exciting field is inspiring, and we're glad to be part of it! If you need support or have questions, don’t hesitate to reach out. Best, Coursiv Team🚀",2026-01-27 03:53:32
2026-04-17T21:41:13.891836+00:00,google_play,io.zimran.coursiv,Coursiv,primary,ee6644f4-0b21-4229-91cf-93f668a73e0f,3NIGMA,1,Time wasting all around puzzle like approaches with minimum real practice orientation. including additional 50EUR cost to get access to the tools itself. NOT WORTHY,2,2026-02-22 14:59:00,2.0.8,"3NIGMA, thank you for sharing your thoughts. We appreciate your feedback regarding the puzzle-like approach and additional costs. Your input is valuable, and we’re dedicated to addressing these concerns. Please reach out to us at support@coursiv.io to continue this conversation privately. We look forward to enhancing your experience!",2026-02-22 15:04:02
2026-04-17T21:41:13.891841+00:00,google_play,io.zimran.coursiv,Coursiv,primary,576eaca8-34eb-4932-ba99-b87d0ee874e6,Belle Farrell,4,Is this course AI generated and written using an AI app? There were many instances where the information was repeated after the introduction to a new subject which I felt was time consuming and unnecessary especially for business persons. Other than this flaw I fee the subject matter is great and applicable to teaching AI apps.,0,2026-01-25 22:15:51,2.0.1,"Thank you for your feedback, Belle Farrell! We appreciate your insights on the course content repetition as we aim for clarity for busy professionals. It's great to know you find the subject matter relevant for teaching AI apps. If you have more suggestions or need assistance, please reach out. Best regards, Coursiv Team🚀",2026-01-25 22:19:25
2026-04-17T21:41:13.891845+00:00,google_play,io.zimran.coursiv,Coursiv,primary,580d6c2f-ab0f-4ac1-8c71-9bac28367959,aasu thapa,5,"did veo. really cool as it takes into consideration the learners psychology and allows to be times, heard and read .... do along example step by step... exactly what a matured learner may need but may not know where to seek it from.",0,2026-03-03 08:16:41,2.0.9,"We're glad to hear you're enjoying the app's thoughtful design for diverse learning styles! Your recognition of its support for mature learners means a lot to us. Your feedback inspires us to improve the educational experience. If you have more suggestions or need assistance, feel free to reach out. Thank you for sharing! Best, Coursiv Team🚀",2026-03-03 08:24:00
2026-04-17T21:41:13.891851+00:00,google_play,io.zimran.coursiv,Coursiv,primary,b73564fd-c87f-47eb-a4e4-27a1e29c1eaf,Deirdre George,4,"Coursiv is pretty awesome, the learning is step by step clear and very motivating that I wish my days wasnt so busy and I could focus all day long on this program. I am learning a lot.",2,2026-01-30 19:10:09,2.0.2,"We're delighted you find the learning clear and motivating! It's fantastic to know you're gaining so much from the program, and we truly appreciate your positive feedback. If you ever need support or have questions, feel free to reach out. Enjoy your learning journey whenever you can! Best regards, Coursiv Team🚀",2026-01-30 19:13:50
2026-04-17T21:41:13.891855+00:00,google_play,io.zimran.coursiv,Coursiv,primary,643a60cb-c973-436e-aea7-9eb91b2ff565,Leslie Erdman,4,In planning a vacation trip I would not only want an itinerary but would also like chatgpt to have ability to book everything needed for me using my chosen discount app and account.,0,2026-02-27 14:07:53,2.0.4,"Leslie Erdman, thank you for your thoughtful feedback! We're excited about your interest in enhancing your travel planning experience. Integrating booking capabilities with your favorite discount app is a fantastic idea. If you have more suggestions or need assistance, don’t hesitate to reach out! Best, Coursiv Team🚀",2026-02-27 14:09:36
2026-04-17T21:41:13.891860+00:00,google_play,io.zimran.coursiv,Coursiv,primary,aeb5a2e0-4b2e-4f45-bcfa-b03a4f4dbb4f,Joe Bitz,4,The lessons lay out teach specific order of format layout for best results using ChatGBT. Even though the area of phocus and application is interchangeable I would like an opeming where I explain what my intentions are for using ChatGBT are and opportunity to apply it to my goals as we progress. 8,0,2026-02-11 12:14:59,2.0.6,"Thank you for your valuable feedback on the lesson structure and your interest in tailored applications! We're glad you find the content effective. Your suggestion for personal intent is appreciated. If you need further assistance, don’t hesitate to reach out. Thank you for your support! Best, Coursiv Team🚀",2026-02-11 12:18:55
2026-04-17T21:41:13.891865+00:00,google_play,io.zimran.coursiv,Coursiv,primary,3dc37664-f15e-49ba-95b9-7992c5e04338,Denny Santiago,5,I really enjoy using this app. It's informative and very educational based on my learning program of interests. I like the flow of how the information is presented that helps with learning retention.,0,2026-03-16 08:01:12,2.1.3,"We're glad the app aligns with your learning interests and that you find the information flow helpful for retention! Your feedback means a lot to us, and we're happy it's positively impacting your educational journey. If you have more suggestions or need assistance, just reach out. Thank you for sharing! Best, Coursiv Team🚀",2026-03-16 08:11:35
2026-04-17T21:41:13.891870+00:00,google_play,io.zimran.coursiv,Coursiv,primary,58491137-133a-40b8-8c40-b5c643818780,Wallace M,5,"Coursiv learning is my new routine. Every morning I want to start my day by learning a new thing. The course topics are exciting, easy to learn and engaging. Don't be left out. Enrol now!",0,2026-03-08 09:50:21,2.1.1,"It's wonderful to hear that you've made learning a daily routine! Your enthusiasm for the engaging topics is inspiring, and we're glad our app helps you start your mornings positively. Thank you for sharing! If you have questions or need support, don’t hesitate to reach out. Best, Coursiv Team🚀",2026-03-08 09:54:17
2026-04-17T21:41:13.891875+00:00,google_play,io.zimran.coursiv,Coursiv,primary,d417a885-2d85-423a-82c7-04a52a986073,Mukesh Gupta,1,"they are fraud, bought a one time package and they activated a subscription without my consent, when I deactivate the subscription they are not allowing me to take the course for which I had paid upfront.",2,2026-02-27 10:25:04,2.0.9,"Hi Mukesh Gupta, thank you for your feedback regarding the subscription and course access. We’re dedicated to resolving this for you. Please contact us at support@coursiv.io so we can assist you further. Your satisfaction matters, and we look forward to improving your experience!",2026-02-27 10:34:49
2026-04-17T21:41:13.891880+00:00,google_play,io.zimran.coursiv,Coursiv,primary,2f33c287-25cc-4e5f-80fd-866e73268ee8,Arlethia Washington,5,"Easy to follow. It's better than I expected. Has clear how to do this instructions for each category. Also contains useful library and resources, too",2,2026-02-23 01:42:08,2.0.8,"Hello! It's fantastic to know that you found the instructions clear and the resources helpful! Your insight means a lot to us, and we're grateful for your positive feedback. If you have any questions or need further support, feel free to reach out. Thank you for sharing your experience! Best regards, Coursiv Team🚀",2026-02-23 01:43:35
2026-04-17T21:41:13.891884+00:00,google_play,io.zimran.coursiv,Coursiv,primary,7da3b14c-a7c9-4cd1-84c5-98e14f314042,Elizabeth Harkins,5,"Just getting going, but the platform is great. I can go at the speed I prefer and circle back when needed. I already feel less intimidated!",0,2026-03-05 18:52:57,2.1.1,"Elizabeth Harkins, it’s wonderful to hear that you’re finding the platform enjoyable and flexible! Your journey is just beginning, and it’s fantastic to know you’re feeling more at ease. Thank you for sharing your experience! If you need any assistance or have questions, feel free to reach out. Best regards, Coursiv Team🚀",2026-03-05 18:59:50
2026-04-17T21:41:13.891889+00:00,google_play,io.zimran.coursiv,Coursiv,primary,fee6b27e-ccec-4fb4-b437-e0647f03c1b7,Ellen Afadhali Uwonkunda,5,"I was skeptical at the beginning and made many complaints but when I started using learning materials, I became impressed and regretted my complaints. it is user friendly and very educative.",0,2026-01-25 16:10:30,2.0.1,"Hello! It's fantastic to hear you've moved from skepticism to enjoyment! We're glad the learning materials have positively impacted you and that you find the app user-friendly and educational. Thank you for your kind feedback! If you need assistance or have more thoughts, we're here to help. Best, Coursiv Team🚀",2026-01-25 19:24:04
2026-04-17T21:41:13.891894+00:00,google_play,io.zimran.coursiv,Coursiv,primary,81cc9bbe-bf79-44d0-a162-5b9ba034f857,Christopher Bueso,4,"Great, simple, and clear instructions. Gives you a user friendly practical breakdown into the foundation and deep understanding of AI. Through use of Chat GPT and majority of other advanced AI software's.",1,2026-01-25 08:58:08,2.0.1,"It's wonderful to hear that you found the instructions clear and user-friendly! Your appreciation for the practical breakdown of AI fundamentals is greatly valued—thank you for sharing your positive experience with us! If you have any further questions or need assistance, feel free to reach out. Best regards, Coursiv Team🚀",2026-01-25 09:04:08
2026-04-17T21:41:13.891898+00:00,google_play,io.zimran.coursiv,Coursiv,primary,588d2512-7b0b-4c69-837b-6c50e88467e3,Minister Samuel Michuki,3,"wow, it's really engaging, and it's more worthy and idealistic to spend more time learning here than being on social media. with this knowledge, you will even be able to utilize the full potential of your social media to work for you.",0,2026-01-21 04:57:06,2.0.1,"Minister Samuel Michuki, thank you for your fantastic feedback! We're delighted you find the app engaging and valuable for learning. Your enthusiasm means a lot to us. If you have suggestions or need assistance, please reach out at support@coursiv.io. Enjoy your learning journey!",2026-01-21 04:59:10
2026-04-17T21:41:13.891903+00:00,google_play,io.zimran.coursiv,Coursiv,primary,6703d0ee-6682-4e57-a736-c2fb3ebf5766,Richard Mayer,4,"Off to a good start, but needs more clarity re tools: Can I use those included for instruction on my own as well? I'd like to practice. Or should I pay fees and load as needed for each of these?",0,2026-01-20 00:28:18,2.0.1,"It's fantastic to see you're getting started! We appreciate your desire for clarity on tool usage and encourage you to explore the app's options for a deeper understanding. If you have more questions or need support, don’t hesitate to reach out. Happy learning! Best, Coursiv Team🚀",2026-01-20 00:34:43
2026-04-17T21:41:13.891908+00:00,google_play,io.zimran.coursiv,Coursiv,primary,8e9e2452-c4ce-4c7f-b354-c3f0512dbe6d,Sitakanta Dash,1,"It is totally a scam. once you pay for trail run, automatically your money like 10000 rupees will be deducted without your consent. later you will not get it back. Be careful.",4,2026-02-18 12:56:09,2.0.8,"Sitakanta Dash, thank you for sharing your experience. It's concerning to hear about the billing issue. We appreciate your feedback and are committed to resolving this. Please reach out to our support team at support@coursiv.io for further assistance. Your insights are invaluable to us!",2026-02-18 12:59:28
2026-04-17T21:41:13.891912+00:00,google_play,io.zimran.coursiv,Coursiv,primary,58cf3f9e-787f-4c8f-96c1-9f67a404579a,DUROJAIYE ABDULHAKEEM,5,The teaching techniques are made simple and easy to navigate with the examples given to work on. I love it!!!,0,2026-02-27 00:00:31,2.0.9,Hey there! 🤩 It’s fantastic to hear how much you appreciate the simplicity and clarity in our teaching methods! We’re thrilled you’re enjoying the examples and finding them easy to navigate. Keep up the great work and happy learning! 🚀,2026-02-27 00:03:37
2026-04-17T21:41:13.891917+00:00,google_play,io.zimran.coursiv,Coursiv,primary,14cf3aeb-6d88-4225-a07b-38e758687e84,kit van der Merwe,1,this is not a free app plus charges for apps/tools and monthly subscriptions. this is not worth the money and took money I did not agree to. did not get the value I thought I would and there are free alternatives to this.,1,2026-02-24 04:25:10,2.0.8,"Hi kit van der Merwe, thank you for your feedback about the app's costs and value. Your satisfaction is important to us, and we’re dedicated to making improvements. We appreciate your insights! If you'd like to discuss this further, please reach out at support@coursiv.io. We look forward to hearing from you!",2026-02-24 04:28:44
2026-04-17T21:41:13.891922+00:00,google_play,io.zimran.coursiv,Coursiv,primary,c9559721-92cf-4060-9e86-d9c8e8d31055,Jadah Milam,4,Good introduction to easy possibilities. I think you have to change your mindset from creating for yourself to letting a bot do it for you and accepting that it is ok.,0,2026-02-08 19:44:58,2.0.4,"It's wonderful to hear that you found the introduction valuable and insightful! Embracing new possibilities can be a refreshing journey, and your perspective on shifting mindsets is truly thought-provoking. Thank you for your feedback! If you have any questions or need further support, feel free to reach out. Best regards, Coursiv Team🚀",2026-02-08 19:49:19
2026-04-17T21:41:13.891926+00:00,google_play,io.zimran.coursiv,Coursiv,primary,cde43931-dd95-414d-9dd8-5d0958182894,leticia ibarra,5,"i am new to AI. And the first prompt encouraged me to do a solo weekend trip with an itinerary in a budget, something I've wanted to do. Just didn't know how to go about doing it now.I do",0,2026-03-06 07:10:42,2.1.1,"It's great to see you're getting inspired to take that solo trip! Embracing new experiences is a wonderful step, and we're glad our app has helped you find your way to planning it. If you need any further assistance or tips along the way, feel free to reach out. Enjoy the adventure ahead! Best regards, Coursiv Team🚀",2026-03-06 07:50:07
2026-04-17T21:41:13.891931+00:00,google_play,io.zimran.coursiv,Coursiv,primary,d087566c-8a8a-4ab2-b27f-059bd3d7b5d1,Kabelo Thipe,5,Coursive has reignited my excitement and love for learning. Their structure and delivery has kept me focused and consistent. and the 3days/7days etc milestones keep me motivated to stay consistent. My future self is very grateful and appreciative 🙏,1,2026-02-06 08:07:37,2.0.4,"Kabelo Thipe, it’s wonderful to hear our app has reignited your passion for learning! We're glad the structure and milestones keep you motivated. Your uplifting feedback inspires us, and we’re excited for your future growth! If you need support, don’t hesitate to reach out. Thank you for sharing! Best, Coursiv Team🚀",2026-02-06 08:10:36
2026-04-17T21:41:13.891936+00:00,google_play,io.zimran.coursiv,Coursiv,primary,7314e6de-6d65-4afa-a23b-2937a34c0f77,JM C,5,Learning to use AI tools I never knew I needed. The time spent on this course will enable me to achieve so much more. It will skyrocket my achievements while spending less time than I need to now.,0,2026-03-14 14:50:26,2.1.3,"It's wonderful to hear how impactful the course has been for you, empowering your use of AI tools! Your enthusiasm for maximizing your achievements with improved efficiency is inspiring. If you have any questions or need further support, feel free to reach out. Thank you for sharing your experience! Best regards, Coursiv Team🚀",2026-03-14 14:59:00
2026-04-17T21:41:13.891941+00:00,google_play,io.zimran.coursiv,Coursiv,primary,a3be5be5-ad49-43e5-ab68-7988465555e7,Sergi Chao,5,"Started as a beginner, I found the course is laid out in straightforward concepts which makes it easier to learn. Well done!",0,2026-03-14 17:01:40,2.1.3,"It's wonderful to see you beginning your learning journey with clear concepts! Your feedback reflects our commitment to an accessible experience, and we appreciate your kind words. If you have any questions or need support, don’t hesitate to reach out. Thank you for sharing! Best, Coursiv Team🚀",2026-03-14 17:04:32
2026-04-17T21:41:13.891945+00:00,google_play,io.zimran.coursiv,Coursiv,primary,aa7c28de-0ccf-4be9-ba2e-97f4815091a3,Jessica Hernandez,5,"This tutorial is simple and effective. Best learning platform, I've seen in a long time. Duolingo vibe, and each lesson I have opportunity to practice real life application. Highly recommend",0,2026-01-30 09:30:50,2.0.3,"It's wonderful to know that you find the tutorials simple and effective! We appreciate your recommendation and are excited that you're enjoying the real-life application aspect of the lessons. If you have any questions or need further support, feel free to reach out. Thank you for sharing your positive experience! Best regards, Coursiv Team🚀",2026-01-30 09:34:17
2026-04-17T21:41:13.891950+00:00,google_play,io.zimran.coursiv,Coursiv,primary,25eb0e8f-fc2a-44a3-9c19-f67f016c3a21,Daniel Musa Goyo (Danny),5,AI has taught me the fact that I did not optimize the use of the technology in my interactions before now. I am better equipped to use my devises and communicate better and faster. This has opened many opportunities to me...,0,2026-03-07 16:26:01,2.1.0,"It's wonderful to see how your experience with AI has transformed your interactions and skills! We're so glad you feel better equipped and are discovering new opportunities as a result. Thank you for sharing your positive journey! If you need any further support, feel free to reach out. Best regards, Coursiv Team🚀",2026-03-07 16:29:39
2026-04-17T21:41:13.891954+00:00,google_play,io.zimran.coursiv,Coursiv,primary,97823b1c-afeb-46ba-9bb9-3619072f7b90,Brian Howard,1,very generic. be careful they charge you unwanted 49.99 charges. I got my money back after emailing them 13 times getting ai messeges back 90% of the time. im not sure this program will teach you anything but I hope it does.,1,2026-02-26 04:32:53,2.0.9,"Hi Brian Howard, thank you for your feedback. We appreciate your concerns about the charges and response. Coursiv follows a subscription model with clear renewal terms at sign-up. We have a refund policy in place. For further assistance, please contact our support team at support@coursiv.io. We hope you find value in the program ahead!",2026-02-26 04:38:39
2026-04-17T21:41:13.891959+00:00,google_play,io.zimran.coursiv,Coursiv,primary,50e4ab94-98ef-41e5-9205-648ca65b81d0,Divina Sumalpong,4,It's a great way to start learning and upgrade your technical skills in AI technology. There's so much more to learn according to your interests and goals in life.,0,2026-02-19 04:49:15,2.0.8,"Divina Sumalpong, it's wonderful to hear that you see our platform as a great starting point for enhancing your AI skills! Your enthusiasm for exploring new knowledge is inspiring. If you have any questions or need support, don’t hesitate to reach out. Thank you for sharing your thoughts! Best, Coursiv Team🚀",2026-02-19 04:53:59
2026-04-17T21:41:13.891969+00:00,google_play,io.zimran.coursiv,Coursiv,primary,2f624293-8a51-4f30-8690-99043e2d6041,Craig Walker,5,"The lessons are simple enough to grasp and learn quickly however, useful enough that they can be applied immediately for excellent results.",0,2026-02-23 15:47:04,2.0.8,"It's wonderful to hear that the lessons are both easy to understand and practical for immediate application! Your feedback truly highlights the effectiveness of our content. If you have any questions or need further support, feel free to reach out. Thank you for sharing your experience! Best regards, Coursiv Team🚀",2026-02-23 15:48:56
2026-04-17T21:41:13.891974+00:00,google_play,io.zimran.coursiv,Coursiv,primary,9b1a75e8-b083-4de7-ae71-6d361f78bc7b,Phillip Chewe,4,The language is clear and understood. It is the style of approach that one needs to align and adapt to very quickly. The lessons sharpen the thinking and more so in a business manner.,0,2026-03-12 10:01:27,2.1.1,"Hello! We appreciate your feedback on the clarity and engaging style of the lessons! It's wonderful to hear how the content sharpens your thinking and enhances your business skills. Thank you for sharing your insights! If you have any further questions or need support, feel free to reach out. Best regards, Coursiv Team🚀",2026-03-12 10:04:53
2026-04-17T21:41:13.891979+00:00,google_play,io.zimran.coursiv,Coursiv,primary,b53e333b-66a1-45b7-acc8-36eb58d1d3cf,Mariette Swanepoel,5,"I've been using ChatGPT in my small business for quite some time. This course gives me more insight for various prompts, modes and features to get much more powerful results.",0,2026-02-04 12:50:36,2.0.4,"It's wonderful to know you're gaining valuable insights for your business! We appreciate your feedback and are glad the course is enhancing your experience with prompts, modes, and features. If you have any questions or need support, don’t hesitate to reach out. Enjoy exploring the powerful results ahead! Best, Coursiv Team🚀",2026-02-04 13:01:26
2026-04-17T21:41:13.891983+00:00,google_play,io.zimran.coursiv,Coursiv,primary,df5f7acc-4ba8-4a41-a632-f8049de6fab9,Wadih Farah,5,"interesting! at my age... it is a great app to understand the AI and explore its tools, so, I can keep my self uptodate and be able to discuss AI subject with my kids.",0,2026-03-14 04:54:30,2.1.1,"We're delighted you're enjoying the app and finding it helpful for discussing AI with your kids! Your feedback inspires us to keep supporting learners of all ages. If you have any questions or need assistance, don’t hesitate to reach out. Best, Coursiv Team🚀",2026-03-14 04:59:24
2026-04-17T21:41:13.891988+00:00,google_play,io.zimran.coursiv,Coursiv,primary,89a1a080-0bea-4215-b639-ad71cf16214e,Phillip Vanderlaan,4,Coursiv is definitely a great tool for beginners to learn AI tools. I use it every day doing short lessons that aren't overwhelming.,1,2026-02-10 13:25:12,2.0.4,"It's fantastic to hear that you find the tool helpful for learning AI! We're so glad that the daily lessons are manageable and enjoyable for you. Thank you for sharing your positive experience! If you ever need further support or have any questions, feel free to reach out. Best regards, Coursiv Team🚀",2026-02-10 13:34:24
2026-04-17T21:41:13.891993+00:00,google_play,io.zimran.coursiv,Coursiv,primary,37434514-8853-4045-bec2-655172aa7417,Robert R,5,"Stays on topic, practical basic understanding of lessons brings the possibilities to life and helps your vision of moving forward stay exciting! Can't wait to implement all these techniques in my own creations. So far ? So worth it.",0,2026-01-27 18:20:52,2.0.2,"It's fantastic to hear that the lessons are resonating with you and sparking excitement for your own projects! Thank you for your wonderful feedback. We appreciate your enthusiasm and support. Enjoy implementing those techniques, and if you need any assistance along the way, feel free to reach out! Best regards, Coursiv Team🚀",2026-01-27 18:23:58
2026-04-17T21:41:13.891998+00:00,google_play,io.zimran.coursiv,Coursiv,primary,37fa3ecb-6144-472b-9d8b-10170303b4e9,Daytona Barbara,5,"I am loving this! simple to the point instructions with practical example and, top it all off, you give us practice time. wish college was so easy!",0,2026-03-06 20:49:16,2.1.1,"It's fantastic to hear that you appreciate the straightforward instructions and practical examples! We're so glad that the practice time enhances your learning experience. Thank you for sharing your thoughts! If you ever need further support or have any questions, feel free to reach out. Best regards, Coursiv Team🚀",2026-03-06 20:54:57
