scraped_at,platform,app_id,app_name,app_priority,review_id,author,rating,review_text,thumbs_up,review_date,app_version,reply_text,reply_date
2026-04-17T21:41:13.890816+00:00,google_play,io.zimran.coursiv,Coursiv,primary,3f404bb1-c643-47b5-92a1-c5961917c8b0,Aurora Wilson,1,"When I paid $40 for this app, I thought I was paying in full. I didn't realize that this is a subscription model. When they renewed, they charged me $80 for 3 months!! I have repeatedly asked for my money back, they have declined. They have offered me more of a service that I don't want, didn't enjoy (too basic) and am never going to use again. I really wouldn't bother. You can learn all this on ChatGPT or Claude. They didn't teach you how to use prompts... ran out of room to continue",4,2026-03-30 16:30:41,2.1.5,"Aurora Wilson, thank you for your feedback. We appreciate your thoughts on our subscription model and renewal charges. These details are outlined at sign-up. For any assistance, please reach out to our support team at support@coursiv.io. Wishing you the best in finding resources that suit your learning style!",2026-03-30 16:37:18
2026-04-17T21:41:13.890840+00:00,google_play,io.zimran.coursiv,Coursiv,primary,162437bf-a959-4d3b-96e4-42a668c7be8a,Victoria Gomez Cruz,4,"I love the ease of the fill in the blank options. the only improvement I'd suggest is if we get it wrong is to give an option to give the reason why and or the explanation of the correct answer and not just go straight to the next question or next content, and or a second chance to correctly answer it again. also why does it say ""almost right, or almost correct"" something like that, but then it doesn't give an explanation why or the correct answer. Or than that everything else is great!",2,2026-04-04 08:24:18,2.1.6,"We're glad you're enjoying the app and find the fill-in-the-blank options helpful! Your suggestions for explanations and second chances are appreciated. If you have more ideas or need assistance, feel free to reach out. Best, Coursiv Team🚀",2026-04-04 09:17:04
2026-04-17T21:41:13.890847+00:00,google_play,io.zimran.coursiv,Coursiv,primary,59383e03-e9eb-476a-b74c-367a549f4dbe,Kerin Elias,5,"I've had minimal understanding of current AI, due primarily to lack of exposure. I wanted to learn about the different platforms to see if I could increase my income by using AI. This course is a PERFECT starting place for that - not too simple, but also not too advanced. AND, provides certificates I can post on LinkedIn to prove I've done the studying! THANK YOU for creating this!",0,2026-04-08 02:18:30,2.1.6,"We're glad our app has provided a solid foundation in AI and suits your needs! If you have questions or need support as you continue learning, feel free to reach out. Thank you for sharing your experience! Best, Coursiv Team🚀",2026-04-08 02:30:56
2026-04-17T21:41:13.890853+00:00,google_play,io.zimran.coursiv,Coursiv,primary,d60d50f0-34a8-4606-b1d2-2d2b6f51e5fe,SavaG3 AnG3L,4,When I saw the ad for Coursiv there was a set price for the course. On the next screen was an offer for am AI ton box and then a different price. And then again after continuing there was another price. The way they had it set up made it look like the price was just added together but what ended up happening was they were each individual prices and I ended up spending over $200. I felt like it was a bait and switch,1,2026-04-03 19:22:00,2.1.6,"Thank you for your feedback on pricing; we aim for clarity in our offerings. Your insights will help us improve. We're glad you're interested in our courses and want to enhance your learning experience. For more details, please use the support options in the app. Best, Coursiv Team🚀",2026-04-03 20:33:38
2026-04-17T21:41:13.890859+00:00,google_play,io.zimran.coursiv,Coursiv,primary,72d3bd2d-c8bc-4123-a2ac-e88b7aa9a21a,Joseph Pollitt,1,"This company operates very shady. I signed up for the trial at $39.99 for 3 months. When I look at my Credit Card transactions I saw two charges at $39.99 and another charge at $49.99. So my expected $40 charge turned into $120. I reached out to them via email to discribe the discrepancy, and after a few back and forth emails they only would give me a refund on the $49.99. I would not give this company any stars simply for the way they operate and their customer service. Don't recommend.",2,2026-03-05 06:37:35,2.1.0,"Joseph Pollitt, thank you for your feedback. We appreciate your concerns about the unexpected charges. Coursiv uses a subscription model with clear renewal terms at sign-up. We have a refund policy in place. For assistance, please contact our support team at support@coursiv.io. Your input helps us improve!",2026-03-05 06:39:07
2026-04-17T21:41:13.890864+00:00,google_play,io.zimran.coursiv,Coursiv,primary,3700efde-75e2-40c6-b3a5-d1805e26b184,Greg Schultz,4,"I'm just beginning the course--2 days in. After getting past the Hard Sell to Buy More before you get to test the waters, I've enjoyed (and learned from) the lessons. Upon reading most of the bad reviews, it seems like most of the complaining subscribers did not do their due-diligence and read the details re: Billing contract/agreement. Also, there has been a minor glitch once or twice, but it's easy to report, and I'm keeping a ""wait and see"" approach"" right now. So far, so good.",8,2026-03-01 06:53:35,2.0.9,"We're glad you're enjoying the lessons and finding them valuable! Thank you for your feedback on the billing agreement, and it's good to know the glitches are minor and reportable. If you have any questions or need assistance as you continue, don’t hesitate to reach out. We appreciate your thoughts! Best, Coursiv Team🚀",2026-03-01 06:59:03
2026-04-17T21:41:13.890868+00:00,google_play,io.zimran.coursiv,Coursiv,primary,e20cce7a-c592-47ca-b7b1-35bfe4f95a3c,S Watson,5,"I decided to learn more about AI and found Coursiv. The introductory pricing was appealing. I've only completed a few of AI models, but the amount I've learned about some of these models have exceeded my expectations and has given me the knowledge necessary to use AI effectively. I never realized there were so many differences. I love the short courses in very easy formats. The summarization with the key takeaways, at the end of each course, is very helpful. Highly recommend!",6,2026-03-21 21:25:45,2.1.4,"It's wonderful to hear you're enjoying your learning experience! We appreciate your kind words about our courses and the format, especially the key takeaways. If you have questions or need support, don’t hesitate to reach out. Your recommendation means so much to us! Best, Coursiv Team🚀",2026-03-21 21:29:29
2026-04-17T21:41:13.890873+00:00,google_play,io.zimran.coursiv,Coursiv,primary,6252d502-3089-4fdd-8399-09cc437c68e0,Ludmila Guarini,1,"The material is not as up to date and thorough as it should be for a paid app. The AI lessons included here can easily be covered with the free guides that each AI engine already provides. And to top it off, they will advertise one price at sign up, but hit you with unauthorized charges after the fact.",6,2026-03-17 07:12:26,2.1.3,"Dear Ludmila Guarini, thank you for your feedback. It's concerning to hear that the material didn't meet your expectations and that you felt misled by pricing. Your insights are important, and we’re dedicated to addressing these issues. Please reach out to support@coursiv.io to discuss further. We appreciate your help in improving!",2026-03-17 07:15:08
2026-04-17T21:41:13.890878+00:00,google_play,io.zimran.coursiv,Coursiv,primary,c5a59c41-7176-482a-88de-0e9b62a7566f,Char Simmons,1,"I signed on for a week for $19.99. Thought the subscription ended after that, but it didn't. The price went up to $39.99 Every 28days supposedly. They have been debiting my account twice (2 times) a month Not just once for $39.99 😡. Not $39.99 Every 28 days as the agreement stated. They took $39.99 on 1/2/2026 and $39.99 today 1/24/2026. At this point they're just stealing my money. What makes me even more Angry is that I haven't even been utilizing the app smh Watch ur Acct if you get the app",33,2026-01-24 18:09:02,2.0.1,"Char Simmons, we appreciate your feedback regarding the unexpected charges. Please contact our support team at support@coursiv.io so we can assist you further. Your input is invaluable, and we look forward to resolving this for you soon. Thank you, and we wish you all the best!",2026-01-24 18:19:38
2026-04-17T21:41:13.890883+00:00,google_play,io.zimran.coursiv,Coursiv,primary,8c10bb19-f897-44a0-a7c1-84c4d061822d,Creston Witte,3,"I am only two days in, and it's not bad. It just felt REALLY Skeezy when they offered the extra ""options"" after I already bought the training. Not pleased with that. Reviews say its hard to cancel and it auto renews. It was not at all clear that it auto renews and apparently for full price. But I already purchased, so I am going to try to get the most out of it.",23,2026-01-04 06:34:05,1.9.9.1,"Hi Creston Witte, thank you for your feedback! We appreciate your insights on the additional options and auto-renewal. Your input is important to us, and we’re here to help. If you have more details or need assistance, please contact us at support@coursiv.io. Wishing you a rewarding training journey!",2026-01-04 06:38:29
2026-04-17T21:41:13.890887+00:00,google_play,io.zimran.coursiv,Coursiv,primary,ecbd128f-f8c7-499d-9285-f930ab6e1a81,The HourGla:S Artistry Lounge,5,"It doesn't make me feel overwhelmed... and it always allows me to revisit any task whenever,. In addition, it's pleasant to have optimism especially when you are learning... stay at your pace but then push a little harder and you will have that mental ""breakthrough"" that will expedite your spirit to keep going further and not be mentally left behind. God bless",4,2025-12-15 09:07:06,1.9.5,"Hello! We appreciate your thoughtful feedback! It’s wonderful to hear that the app helps you manage your learning pace while fostering a positive mindset. Your insights on achieving mental breakthroughs are truly inspiring. If you need any further support, feel free to reach out! Best regards, Coursiv Team🚀",2025-12-15 09:14:15
2026-04-17T21:41:13.890892+00:00,google_play,io.zimran.coursiv,Coursiv,primary,f4c75abe-fdcb-4459-826e-df72c82e86c4,Russell Mitchell,5,"Wasn't too keen on the method it uses at first and even considered cancelling at one point, but I decided to finish at least one course, the chat gpt course, and decide then. When I finished, I took the test and was amazed at how much I'd learned without even realizing it. I took the test, downloaded my certificate, and now I'm hooked. Moving onto Midjourney today and plan on completing all the courses. Thank you for an awesome product!!!",52,2025-11-17 04:52:59,1.9.0,"Hello! It's fantastic to hear that you found value in the courses! Your experience of surprising learning outcomes and earning a certificate truly highlights the app's effectiveness. We’re excited that you’re eager to dive into more courses—there’s so much to explore! Thank you for sharing your journey with us! Best regards, Coursiv Team🚀",2025-11-17 05:08:46
2026-04-17T21:41:13.890897+00:00,google_play,io.zimran.coursiv,Coursiv,primary,f19d3f07-3931-4821-b290-bce02ebb8936,NEPA PizzaReview,1,the app is pretty basic and provides basic skills to leverage Ai. I was already a chatgpt user and didn't really get much out of the courses. the micro learning becomes very redundant and requires a lot of constant tapping while the ai voice glitches reading it to you. overall I think for beginners this would be a solid project. I found it to be a waste of money and they kept charging me as a subscription. make sure you cancel right away if you dont intend to keep renewing as it's expensive,40,2025-11-30 21:55:33,1.9.2,"Thank you for sharing your thoughts! Feedback on the app's content and AI voice is truly appreciated. It's important to hear that the micro-learning felt repetitive. Please reach out to our support team at support@coursiv.io, as we are committed to resolving the issue and improving our services. Wishing you all the best on your AI journey!",2025-12-02 01:04:09
2026-04-17T21:41:13.890901+00:00,google_play,io.zimran.coursiv,Coursiv,primary,742ebfda-95ed-47de-aef1-40d5243ca5c2,Spencer P,1,"DO NOT USE. Tried to cancel my subscription several times, then when I ended up contacting my credit card to stop the charges they replied direclty to the credit company, disputing the chargebacks saying I had been accessing and using the app on a regular basis, which is 100% untrue. I cannot emphasize enough how problematic and difficult it has been to keep this company from stealing hundreds of dollars from me.",79,2025-11-30 07:01:47,1.9.2,"Thank you for sharing your experience. It's concerning to hear about the challenges faced while trying to cancel the subscription. Your feedback is essential, and our team is committed to resolving this issue and improving our services. Please reach out to support at support@coursiv.io for assistance.",2025-12-02 01:04:14
2026-04-17T21:41:13.890906+00:00,google_play,io.zimran.coursiv,Coursiv,primary,c980c612-4413-4c06-bedd-8a76bb1f876a,Mark Carrisal,1,"I feel like the language to initial payment and renewal is a rip off they charged me twice at 39.00 for not a single module after having difficulty understanding how to use the app,I was promised a 30 guarantee to get a refund if I wasn't satisfied and that was a joke, just a AI email 1 second response and denying my refund, the fleecing of our hard working money continues with Apps like this. BEWARE!",42,2025-12-27 18:06:16,1.9.9.1,"Mark Carrisal, thank you for your feedback regarding the payment process and refund situation. Coursiv follows a subscription model with clear renewal terms at sign-up. We have a refund policy in place. For further assistance, please contact our support team at support@coursiv.io. Wishing you better experiences ahead!",2025-12-27 18:08:17
2026-04-17T21:41:13.890911+00:00,google_play,io.zimran.coursiv,Coursiv,primary,c5391b8f-f7ea-4b93-a6b1-53d1be1a85a3,Romel Simon,1,"I kept seeing Coursiv ads on Facebook, so I decided to try their $15 “intro to AI” course. The price seemed low-risk, but their registration process turned out to be very confusing on purpose. After signing up, I got a credit card alert showing an extra $50 charge for some “upgrade” I never meant to buy. There’s no phone number to call, only chat support. When I contacted them right away, they refused to refund me or cancel the course. Coursiv is a scam.",120,2025-10-26 14:07:02,1.8.5,"Hello! It's disappointing to hear about the experience with the registration process and charges. Your feedback is invaluable, and we are committed to resolving this issue. Please reach out to our support team at support@coursiv.io for assistance. Thank you for sharing your thoughts!",2025-10-26 15:09:24
2026-04-17T21:41:13.890915+00:00,google_play,io.zimran.coursiv,Coursiv,primary,ee39b00e-72a5-421c-8965-b3629a6a360e,H Stark,2,"I used it for a week. There wasn't anything being taught that I couldn't figure out just by playing with various AI models for my purposes, so I unsubscribed about a month later. Today, months later, I saw they're still charging me! If you need AI for business purposes, this might be a good app for you. But, whether for business or non-professional reasons, keep a close eye on your account if you unsubscribe.",9,2025-12-04 06:58:11,,"Hi H Stark, I apologize for the negative experience with unexpected charges after unsubscribing. Thank you for sharing your feedback; it truly helps us improve. We want to ensure clarity regarding subscriptions for all users. Please reach out to support@coursiv.io so we can continue this conversation privately.",2025-12-10 15:54:30
2026-04-17T21:41:13.890920+00:00,google_play,io.zimran.coursiv,Coursiv,primary,be29ae94-3ba4-4560-84d5-8cd92985f1a1,Guillermo Martinez,4,"Interesting learning process. I see why so many might find it too easy, but they might be missing the point. By taking small steps, daily, it helps retain better the concepts. Definitely not for everyone. But can be engaging for others, specially if you have a very short attention span.",121,2025-09-11 17:38:08,1.7.6,"Hello! Thank you for your thoughtful feedback. We appreciate your recognition of our gradual learning approach and its impact on retention. Your insights are vital for our improvement. If you have more thoughts, feel free to contact our support team at support@coursiv.io. Best, Coursiv Team🚀",2025-09-26 03:56:30
2026-04-17T21:41:13.890925+00:00,google_play,io.zimran.coursiv,Coursiv,primary,9e3ec0ac-9de5-41f2-8b0c-a12ebbd9779a,Kaz Art,4,"Because this is a specific artistic AI, it looks, feels, and operates differently than the other AI programs that I've used. Information was chunked down to a very basic level and learning style. The artistic concepts were identified and accessed through multiple choice answers. I chose this AI because it was ""different"". And it is!",94,2025-07-04 11:13:42,1.6.3,We appreciate your insight into how our app stands out from others and how its unique approach resonates with your artistic journey! Thank you for sharing your experience!,2025-11-14 00:55:37
2026-04-17T21:41:13.890930+00:00,google_play,io.zimran.coursiv,Coursiv,primary,4167293b-4598-4e8f-ae07-caf2f959347d,Louis Rodríguez,5,I have been trying Courses to learn how to operate the generative AI models and I find it very helpful and informative. They implemented technology to simulate your lessons on different levels as you progress with knowledge using various notable models and they integrate a vast amount of AI tools to enhance your learning experience. i was surprised to see how many tools integrate with the system and it all compliments each other in a powerful way. I definitely recommend this app to anyone.,162,2025-07-21 16:24:35,1.6.6,"Hello! Thank you for your fantastic review! We're delighted the app is enhancing your learning about generative AI models and that you find the tool integration beneficial. We appreciate your support and encourage you to keep exploring. If you need assistance, we're here for you! Best, Coursiv Team🚀",2025-10-07 12:59:59
2026-04-17T21:41:13.890934+00:00,google_play,io.zimran.coursiv,Coursiv,primary,d14bbefa-1743-45b4-addd-6c35f8b4f0bf,Zuhra Shash'a,2,"I liked the content of the app and the way the journey is built through each course. However, I feel it's quite expensive to maintain the full price, especially since we are not using the full AI toolkit. On top of that, they have the audacity to discontinue the certificate after you cancel the subscription, even though you obtained it while you were a subscriber to their services. I find that a bit rude, and it changed my whole perceived experience about the app.",2,2026-04-07 01:33:15,2.1.6,"Zuhra Shash'a, we appreciate your feedback on the subscription pricing and certificate policy. It's great to hear you enjoyed the course content! Please reach out at support@coursiv.io to discuss further. We value your input and hope you continue to enjoy your learning journey!",2026-04-07 01:40:44
2026-04-17T21:41:13.890939+00:00,google_play,io.zimran.coursiv,Coursiv,primary,fb15b87e-89cc-439e-91c5-c268cfbd156e,Christiaan Grosskopf,1,"They advertise programs at a fixed rate but hidden in the T&Cs they will continue deducting money at a higher rate if you do not unsubscribe, even though it was supposed to be a once-off payment. In some responses here they claim that they make it clear that it is a subscription model at sign up but sadly that is not the case - they keep quiet about that.",0,2026-04-15 03:40:18,2.1.8,"Christiaan Grosskopf, thank you for your feedback on our payment structure. We're committed to improving clarity around our subscription model. Please reach out at support@coursiv.io so we can resolve this together. We appreciate your understanding and aim to enhance your experience.",2026-04-15 03:45:18
2026-04-17T21:41:13.890944+00:00,google_play,io.zimran.coursiv,Coursiv,primary,0a19bd66-6c31-4d96-b364-0f5cd6444ad1,Roopak Patel,1,"I subscribed to the $9.99 introductory offer for basic AI courses. A few weeks later, I noticed an additional $50 charge from Coursiv and contacted support. They claimed I purchased extra access to ChatGPT and other AI tools. I did NOT subscribe to any such services. I suggested it could be a technical glitch or confusing app options. I have NOT used those additional tools even once. Despite multiple requests, Coursiv DENIED a full refund. Be careful!",5,2026-03-23 07:38:13,2.1.4,"Dear Roopak Patel, thank you for sharing your concerns. Coursiv operates on a subscription model with recurring billing, which is highlighted during sign-up. We do have a refund policy, so please contact our support team at support@coursiv.io for help. Your feedback is important, and we look forward to resolving this for you.",2026-03-23 07:44:21
2026-04-17T21:41:13.890948+00:00,google_play,io.zimran.coursiv,Coursiv,primary,c30173ec-559a-4bfc-8b73-0a324e2b3fd7,Flash,1,"This service employs deceptive marketing and predatory billing practices. After enrolling in a low-cost trial, I was hit with over $400 in undisclosed fees over a period of 5 months. I only discovered these charges by chance and have since terminated the subscription. Despite having barely used the platform, my request for a complimentary month to actually value the service was also denied. This is a clear instance of bait-and-switch pricing and unauthorized subscription billing.",5,2026-03-17 22:47:19,2.1.3,"Hello Flash, Thank you for sharing your concerns about our billing and marketing practices. Your feedback is invaluable, and we’re dedicated to addressing this issue. Please contact us at support@coursiv.io to discuss this further. We look forward to improving your experience in the future.",2026-03-17 22:49:12
2026-04-17T21:41:13.890953+00:00,google_play,io.zimran.coursiv,Coursiv,primary,a99cc8e2-1fbe-406e-8d7e-d0d2e2c6f021,Lord Black Rabbit,1,"Coursiv gets you to sign up by promising a learning experience and then as soon as you have signed up, bombards you with ""special"" offers valid ""only for the next 10 minutes. So far it's looking very much like Coursiv is a racket for getting people to buy stuff that they may or may not need. I very seldom buy stuff that pops up as advertising when using ""free"" apps on my handset. But Coursiv kept popping up constantly. so I bought it. And so far I am not impressed.",15,2026-02-16 09:54:22,2.0.8,"Hello ""The Dark Lord Rabbit,"" We appreciate your feedback regarding the promotional offers. Your insights are valuable, and we’re dedicated to enhancing your experience. Please reach out to us at support@coursiv.io to discuss your concerns directly. Thank you for sharing, and we hope you find value in your journey with us!",2026-02-16 09:59:31
2026-04-17T21:41:13.890958+00:00,google_play,io.zimran.coursiv,Coursiv,primary,1dde7f96-3f37-4da5-a17f-6d7793c59af2,Alison Brennan,4,"During an early lesson on image creation using Midjourney, one out of two possible options was not available to me. I was able to replace 'big' with 'towering' but not with 'gigantic'. Very annoying! I suspect a bug in the tutorial software. Perhaps I was not supposed to be allowed to choose 'gigantic' because it was the 'wrong' answer, but if that was the case it was not made clear.",2,2026-02-07 01:19:30,2.0.4,"Thank you for your feedback on the image creation tutorial! We appreciate your insights and encourage you to report specific concerns in the app for better assistance. We're here to support you and enhance your learning experience. Thank you for helping us improve! Best, Coursiv Team🚀",2026-02-07 01:23:48
2026-04-17T21:41:13.890963+00:00,google_play,io.zimran.coursiv,Coursiv,primary,eac99fac-0169-411a-b5aa-b3a4823e8af5,Cynthia Laham,1,"Its a Scam, dont use Coursiv I subscribed to basic plan for 19.99 USD. However, I did not continue using the courses as I found the content too basic & repetitive for my needs. yesterday, I was surprised to discover that my subscription had been automatically renewed at 39.99 USD, which is double the original price. While u mentioned that the renewal terms were stated on the sign-up page, I was not clearly aware that the price would increase to the standard rate after the initial price!",14,2026-02-26 17:59:52,2.0.9,"Cynthia Laham, thank you for sharing your experience. We appreciate your feedback on the subscription renewal process and content. Your insights are valuable for our improvement. If you have more details, please reach out at support@coursiv.io. We're here to assist you!",2026-02-26 18:08:58
2026-04-17T21:41:13.890967+00:00,google_play,io.zimran.coursiv,Coursiv,primary,bbea2259-6610-4c26-a8dc-6c4ea02585fd,Dana Geletka,3,"I've been learning this new AI stuff. I'm not far into it. It seems so simple and easy, but I can't get Alexa to turn up the heat or turn a darn light on. I really want to learn this stuff because I got sick a few years back, and I am tired of fighting for disability. It's exhausting. Yet, its expensive to keep paying for courses, I dont have the energy to do them all day either. So I do wish they were more challenging, so I got more out of it cause AI are hard to direct.",0,2026-03-27 06:55:01,2.1.5,"Dear Dana Geletka, thank you for your feedback on the AI learning courses. We appreciate your insights on course difficulty and costs. Balancing learning can be tough, and we’re here to support you. Please reach out at support@coursiv.io for further assistance. Keep pushing forward; your determination is inspiring!",2026-03-27 06:59:37
