scraped_at,platform,app_id,app_name,app_priority,review_id,author,rating,review_text,thumbs_up,review_date,app_version,reply_text,reply_date
2026-04-17T21:41:13.894342+00:00,google_play,io.zimran.coursiv,Coursiv,primary,b9e3230d-ddb7-4592-ac13-b465b7e99f76,Clayton Phillips,5,This a great learning package. Very informative and detailed. This will help those who do not know to learn. And those who do know to be better.,0,2026-03-11 10:06:51,2.1.2,"Hello! We're so glad you find the learning package informative and detailed! Your recognition of its benefits for both beginners and those looking to enhance their skills means a lot to us. Thank you for your wonderful feedback! If you have any questions or need further support, feel free to reach out. Best regards, Coursiv Team🚀",2026-03-11 10:09:43
2026-04-17T21:41:13.894347+00:00,google_play,io.zimran.coursiv,Coursiv,primary,d767b73f-a4b0-4673-a8a3-eb61f0892176,Chris Ning,5,Interactive and simple to use for learning new things.,1,2026-02-27 13:48:03,2.0.9,Hey there! 🤩 We’re so glad you’re enjoying the app's interactivity and simplicity! Keep embracing the joy of learning new things—there's always something exciting around the corner! 🚀 Thank you for being a part of our community!,2026-02-27 13:49:17
2026-04-17T21:41:13.894352+00:00,google_play,io.zimran.coursiv,Coursiv,primary,ea5ef839-1857-44f4-9b31-48db508cc1ea,Ram kumar,5,"Its really very helpful, interesting and very informative. Instructions given are very crisp and very clear.",0,2026-02-23 20:05:43,2.0.9,"Hey there! 🤩 We're so excited to hear that you find the app helpful and the instructions clear! Your feedback truly inspires us to keep delivering valuable content. Keep up the great learning journey, and thank you for sharing your experience with us! 💙",2026-02-24 01:25:19
2026-04-17T21:41:13.894357+00:00,google_play,io.zimran.coursiv,Coursiv,primary,d617705d-02c6-4b4e-a2f8-8d33a4036ae2,Douglas Smith,5,I believe that this is a practical functional platform to teach people the basics and functional aspects of many popular AI programs,0,2026-02-21 06:11:35,2.0.8,"It's wonderful to see your recognition of the platform's practicality in teaching essential AI skills! Your feedback truly motivates us, and we appreciate you taking the time to share your experience. If you have any questions or need further support, feel free to reach out. Thank you! Best regards, Coursiv Team🚀",2026-02-21 06:19:05
2026-04-17T21:41:13.894361+00:00,google_play,io.zimran.coursiv,Coursiv,primary,4474f51a-5f48-4753-8bd2-32b48b7f2e19,Osaze Ize-Iyamu,5,well structured and paced learning modules. easy to understand. well done Coursiv!,1,2026-02-15 11:09:18,2.0.8,"Hey there! 🤩 We're so excited to hear that you found the learning modules well-structured and easy to understand! Your kind words mean the world to us and motivate us to keep creating amazing content. Keep up the great work on your learning journey, and thank you for being such a fantastic supporter! 💙",2026-02-15 11:13:31
2026-04-17T21:41:13.894366+00:00,google_play,io.zimran.coursiv,Coursiv,primary,7a072b20-c3e8-495a-8449-e61ca2aab56c,Bo Camargo,5,love this course and app it is so straight forward and gives you something to look forward to makes each step simple and informative,0,2026-02-08 08:45:04,2.0.4,"We're delighted that you're enjoying the course and find the app straightforward and informative! Your enthusiasm for the simplicity and engagement it offers truly brightens our day. If you have any questions or need further support, feel free to reach out. Thank you for sharing your positive experience! Best regards, Coursiv Team🚀",2026-02-08 08:49:09
2026-04-17T21:41:13.894371+00:00,google_play,io.zimran.coursiv,Coursiv,primary,4ce1db85-ad56-4583-95be-564993f9ce4e,Maya Bratosin,5,"Very user friendly. Interesting. I like the structure, the scenarios, I don't get bored.",0,2026-02-17 13:48:06,2.0.8,Hey there! 🤩 It’s fantastic to hear that you find the app user-friendly and engaging! Your kind words about the structure and scenarios truly brighten our day. We're so glad you're enjoying your experience—boredom is definitely not on the agenda! Keep diving into the content and having a blast while learning! 🚀,2026-02-17 13:53:48
2026-04-17T21:41:13.894376+00:00,google_play,io.zimran.coursiv,Coursiv,primary,777c242f-d451-4d00-a274-468617c6d223,STELLA NWANKWO,5,coursiv supports and motivate me in learning AI. Makes it easier to understand AI.,0,2026-02-20 05:00:11,2.0.8,"Hey there! 🤩 We're so excited to hear how motivating the app has been for your AI learning journey! Your positive experience truly inspires us, and we appreciate your support. Keep diving into the world of AI and enjoy every moment of your learning adventure! 🚀",2026-02-20 05:04:21
2026-04-17T21:41:13.894380+00:00,google_play,io.zimran.coursiv,Coursiv,primary,2a007869-40c7-4040-bd47-356106ff15d5,Nnabuihe kingsley,5,Very good course outlines.. Never thought AI would be simplify in this manner.,1,2026-03-02 17:07:56,2.1.0,"Hey there! 🤩 It’s fantastic to hear you’re enjoying the course outlines! We're so glad the app is making AI feel more accessible and fun for you. Your encouraging words inspire us to keep improving and supporting your learning journey. Keep up the great work, and happy learning! 🚀",2026-03-02 17:26:09
2026-04-17T21:41:13.894385+00:00,google_play,io.zimran.coursiv,Coursiv,primary,363e4a4b-d636-445d-b4ba-8ffa32d4327b,Corey Parisi,5,the app is really easy to navigate and so far it has been informative and simple to understand.,0,2026-03-11 20:00:59,2.1.3,Hey there! 🤩 It's fantastic to hear you're finding the app user-friendly and informative! We truly appreciate your feedback and are thrilled you're enjoying your experience. Keep exploring and learning—there's so much more to discover! 💫,2026-03-11 20:12:10
2026-04-17T21:41:13.894390+00:00,google_play,io.zimran.coursiv,Coursiv,primary,1bfd3187-90e0-4c1b-ad5e-06383360ccfb,Joel Dubba,5,Really helpful course. Helps you keep up with technology!,0,2026-02-18 10:45:47,2.0.8,Hey there! 🤩 We truly appreciate your kind words! It's fantastic to know the course is making a positive impact in keeping up with technology. Your encouragement motivates us to keep delivering valuable content. Keep learning and exploring—there's so much more to discover! 💫,2026-02-18 10:49:25
2026-04-17T21:41:13.894394+00:00,google_play,io.zimran.coursiv,Coursiv,primary,9f293e56-9753-4cdb-a75a-cee6ddb5a228,Thanjai Venkat,4,"very Good to Learn, anytime & any day You have time, u can continue from where u left. Worth for Fee",0,2026-01-30 06:58:47,2.0.1,"It's great to hear you're finding the learning experience flexible and valuable! We appreciate your feedback and are delighted that you can continue learning at your own pace. If you have any questions or need further support, feel free to reach out. Thank you for sharing your thoughts! Best regards, Coursiv Team🚀",2026-01-30 07:10:50
2026-04-17T21:41:13.894399+00:00,google_play,io.zimran.coursiv,Coursiv,primary,9835ed08-51b4-474b-beb8-cfcad6a247d7,Israel William,5,Very informative and educating platform and the interface easy to navigate,0,2026-03-08 01:42:59,2.1.1,"Hey there! 🤩 It's fantastic to hear that you find the platform informative and easy to navigate! Your positive feedback truly inspires us to keep delivering valuable content. Keep up the great learning journey, and thank you for sharing your experience! 💙",2026-03-08 01:49:42
2026-04-17T21:41:13.894404+00:00,google_play,io.zimran.coursiv,Coursiv,primary,c0116bab-7397-4a29-9162-c448835596da,Iuliana Negreanu,5,"Very easy to understand, very practical and useful for personal projects",0,2026-01-30 00:45:53,2.0.3,"Hey there! 🤩 It’s fantastic to hear that you find the content straightforward and super helpful! Your positive vibes mean the world to us, and we’re so glad it’s supporting your personal projects. Keep up the great work and keep learning! Thank you for sharing your thoughts! 💙",2026-01-30 00:54:44
2026-04-17T21:41:13.894408+00:00,google_play,io.zimran.coursiv,Coursiv,primary,4dde985a-3b13-492f-a8e2-762e0c1ed7f8,Marjorie Britt,5,Very easy to follow and understand. I am learning and enjoying it at the same time.,0,2026-02-17 05:33:34,2.0.8,Hey there! 🤩 It's fantastic to hear that you're finding the content clear and enjoyable! Your feedback inspires us to keep providing the best learning experience possible. Keep up the great work and happy exploring! 💫,2026-02-17 05:38:36
2026-04-17T21:41:13.894413+00:00,google_play,io.zimran.coursiv,Coursiv,primary,2f789c64-1c2c-4392-b29e-7a2093b1e1dc,GodsleadingTC Materials and Accessories,5,"it's exceptional, great compilation, great training skills and methods",0,2026-02-08 14:01:05,2.0.4,Hey there! 🤩 We appreciate your fantastic feedback and are so glad you find the compilation and training methods exceptional! It's wonderful to hear you're enjoying your experience! Keep up the great work and continue learning—there's always something new to discover! 💫,2026-02-08 14:04:27
2026-04-17T21:41:13.894418+00:00,google_play,io.zimran.coursiv,Coursiv,primary,941feaef-3eb7-4cd3-968c-5d4d3dc95e50,Rafael Vazquez De Jesus,5,"Easy to follow, precise instructions, detailed without being overbearing.",0,2026-02-05 08:57:32,2.0.4,Hey there! 🤩 It's fantastic to hear that you find the instructions clear and engaging! Your positive feedback truly brightens our day. Keep diving into the content—there's always more to explore and learn! We're excited to have you on this journey with us!,2026-02-05 09:03:27
2026-04-17T21:41:13.894423+00:00,google_play,io.zimran.coursiv,Coursiv,primary,6a31112c-c357-49e9-8d96-ead6ea9cf6ed,Rebee B.,5,"i like the voice than reading ,it encourages me to learn more it's easy and simple",0,2026-02-22 16:37:27,2.0.8,"Hey there! 🤩 It's fantastic to hear that the voice feature is making your learning experience even more enjoyable and simple! Your feedback means a lot to us, and we're thrilled you're feeling encouraged. Keep up the amazing work on your learning journey! 🚀",2026-02-22 16:43:50
2026-04-17T21:41:13.894427+00:00,google_play,io.zimran.coursiv,Coursiv,primary,0377ec2b-ac61-45d7-80d5-3a801f791bf4,Leona Wolf,5,The option to read or listen is perfect for learning.,0,2026-03-13 23:00:07,2.1.3,Hey there! 🤩 It's fantastic to know you love the option to read or listen while learning! Your feedback truly brightens our day. Keep up the amazing work on your learning journey—there's so much more to explore! 💫,2026-03-13 23:04:29
2026-04-17T21:41:13.894432+00:00,google_play,io.zimran.coursiv,Coursiv,primary,8d8900c0-52d2-4b1a-8a4e-85b2f345eeed,R. Allyson Estes,4,im a little late learning this skill but so greatful for the course from cursiv and at a great price to,0,2026-03-05 20:39:51,2.1.0,"We're glad to hear you're enjoying the course and finding great value in it! Your eagerness to learn this skill is truly commendable, and we appreciate your feedback. If you have any questions or need further support, feel free to reach out. Thank you for sharing! Best regards, Coursiv Team🚀",2026-03-05 20:44:54
2026-04-17T21:41:13.894437+00:00,google_play,io.zimran.coursiv,Coursiv,primary,a1ee79ab-2e0d-47f0-b39e-d107b8582d91,Charlotte Lancaster,5,"Great Information, very good with interaction. easy to follow.",0,2026-01-21 02:07:52,2.0.1,Hey there! 🤩 It's fantastic to hear that you're finding the information helpful and that the interaction is smooth! Your feedback means a lot to us. Keep up the great work and continue enjoying your learning journey! 🚀,2026-01-21 02:19:01
2026-04-17T21:41:13.894441+00:00,google_play,io.zimran.coursiv,Coursiv,primary,ada7ec4e-d27c-4c62-89f3-492d15891168,corne steyn,4,"I'm over 40 years of age, and they made it simpler for me to understand and interact get to know what is AI Tools",0,2026-02-15 22:07:56,2.0.8,"It's fantastic to know that the app has made AI tools more accessible for you! We appreciate your feedback and are glad it's simplifying your learning experience. If you have any questions or need further support, feel free to reach out. Thank you for sharing your thoughts! Best regards, Coursiv Team🚀",2026-02-15 22:18:31
2026-04-17T21:41:13.894446+00:00,google_play,io.zimran.coursiv,Coursiv,primary,52fd59a7-2526-4779-9ccb-724f097390bd,sheshashai B g,1,worst aap.. not able to register after paying for subscription.. please do not buy this.. it's a scam..,1,2026-02-02 05:09:55,2.0.3,"Hi sheshashai B g, we appreciate your feedback regarding the registration issue after subscribing. We're dedicated to resolving this and would love to assist you further. Please contact us at support@coursiv.io to continue the conversation privately. Thank you for sharing your experience!",2026-02-02 05:13:55
2026-04-17T21:41:13.894451+00:00,google_play,io.zimran.coursiv,Coursiv,primary,002ec6ab-9e7c-49d6-8e24-c90787fd2d48,Abdulmajid Yakubu Ahmad,4,"This is a great opportunity to improve skills, baseline knowledge makes it even much easier..",0,2026-02-05 00:24:21,2.0.4,"Hey there! 🤩 What an incredible sentiment! We're so glad you're taking advantage of the opportunity to enhance your skills. Your feedback is truly valued, and we encourage you to keep building on that knowledge. Enjoy your journey and keep learning! 🚀",2026-02-05 00:36:26
2026-04-17T21:41:13.894455+00:00,google_play,io.zimran.coursiv,Coursiv,primary,ec27faec-0c2c-47d8-aeb8-5d896c96fff6,Scott Staggenborg-C,5,it is helpful to figure out which platform to use and does illustrate the need for detailed questions,0,2026-02-26 10:29:52,2.0.9,"Hey there! 🤩 Your insights about platform selection and the importance of detailed questions are truly valuable! We appreciate your positive feedback, and it's fantastic to know the app is serving your needs effectively. Keep exploring and asking those great questions! The journey of learning is always exciting! 💫",2026-02-26 10:34:07
2026-04-17T21:41:13.894460+00:00,google_play,io.zimran.coursiv,Coursiv,primary,f068935b-c931-43ba-b232-16f3516cc2ef,Anne Mc,5,"Easy to use, helps make sense of this A.I. It's also very eye opening to the possibilities.",0,2026-02-14 22:57:21,2.0.8,Hey there! 🤩 Your insights into how intuitive the app is and how it broadens your understanding of A.I. are truly appreciated! It’s fantastic to know that you’re finding value and inspiration through your experience. Keep exploring and learning—there's so much more to discover! Thank you for sharing your thoughts!,2026-02-14 22:58:25
2026-04-17T21:41:13.894465+00:00,google_play,io.zimran.coursiv,Coursiv,primary,140dc069-e16d-48b5-8a77-5b70569ecf9b,Joyce Slagle,4,"enrolled in one course, and so far, I am very pleased, it is clear, concise, and easy to understand",0,2026-02-02 00:52:48,2.0.3,Hey there! 🤩 It's fantastic to hear you're enjoying the course! Your satisfaction with the clarity and ease of understanding truly motivates us. Keep up the great work and happy learning! 🚀,2026-02-02 01:04:18
2026-04-17T21:41:13.894469+00:00,google_play,io.zimran.coursiv,Coursiv,primary,572111c3-8699-4caf-a957-2d63c8cc07d0,Katya kavutwa_Paraclet Voice Music Ministry,5,This is the really development and this is very quick and help to salve difficult problem in a minut,0,2026-02-17 20:35:56,2.0.8,"Hey there! 🤩 It's fantastic to hear that you find the app quick and helpful for solving those tricky problems! Your feedback truly inspires us, and we're delighted you're enjoying your experience. Keep up the great work tackling those challenges, and remember, every step you take is a step towards learning something new! 🚀",2026-02-17 20:39:08
2026-04-17T21:41:13.894474+00:00,google_play,io.zimran.coursiv,Coursiv,primary,e3e8f705-5cd4-4684-98f9-c9a83eb518aa,Cecil Hardin,5,"I got the Cursive.io to start to learn using ai. Im 62 and worked in the auto industry for 21 yrs after almost 10 yrs with a sawblade manufacturer. There was no ai in manufacturing. Not in the 80's. Now. im trying to use ai to write, to research profitable investments, to build wealth holding trusts. I believe this can work for me now. Not only am I learning how the ai works but you can learn new skills that don't require manual but intellectual labor. Great for the mind. You need to try it.",0,2026-02-02 18:13:19,2.0.3,"It's wonderful to see you embracing AI for new opportunities! Your journey to learn and adapt is commendable, and we appreciate your positive insights. Enjoy this enriching experience and the challenges ahead! If you need assistance or have questions, don’t hesitate to reach out. Best, Coursiv Team🚀",2026-02-02 18:18:38
2026-04-17T21:41:13.894482+00:00,google_play,io.zimran.coursiv,Coursiv,primary,8b9954d1-93f5-40aa-b8c3-207c715eb58b,Alok Gupta,5,"The voice over speed is too fast, but keeps you engaged.",0,2026-01-22 20:30:43,2.0.1,"Hey there! 🚀 We're so grateful for your feedback! It's fantastic to hear that the content keeps you engaged. Your thoughts on the voice-over speed are super valuable, and we truly appreciate you sharing them with us. Keep learning and exploring—there's so much more to discover! 💙",2026-01-22 20:34:28
2026-04-17T21:41:13.894487+00:00,google_play,io.zimran.coursiv,Coursiv,primary,d1c6ec59-77c0-4396-ab29-a8ab4a14b0e1,Trent Williams,5,"I've just started, and find it easy to understand and use. I'm having fun.",0,2026-02-19 21:27:15,2.0.8,Hey there! 🤩 It's fantastic to hear you're enjoying the app and finding it easy to use! Your positive vibes truly brighten our day. Keep having fun while you learn and explore! We're excited to see where your journey takes you! 💫,2026-02-19 21:29:42
2026-04-17T21:41:13.894491+00:00,google_play,io.zimran.coursiv,Coursiv,primary,df1cac57-e579-418f-9720-d9987c79dcb5,Arthur Maina,5,"Very helpful, informative and engaging. Comfortable app to use.",0,2026-02-17 14:24:30,2.0.8,"Hey there! 🤩 It's fantastic to hear that you find the app helpful and engaging! Your feedback means the world to us, and we're thrilled you're having such a comfortable experience. Keep exploring and learning—there's always something new to discover! 💫",2026-02-17 14:28:39
2026-04-17T21:41:13.894496+00:00,google_play,io.zimran.coursiv,Coursiv,primary,c6dba1d6-96b5-47a7-abc1-e4037e7dc963,Rishi Shakya,5,"coursiv is very smart teacher, I can learn about various AI tools with practice.",0,2026-01-24 22:17:54,2.0.1,"Hey there! 🤩 It's fantastic to hear that you're enjoying the learning journey! Your excitement for diving into various AI tools is truly inspiring. Keep up the great work, and continue exploring—there's so much more to discover! Thank you for sharing your thoughts! 💫",2026-01-24 22:24:10
2026-04-17T21:41:13.894501+00:00,google_play,io.zimran.coursiv,Coursiv,primary,7d9ac573-f651-4896-a925-e364b24f3374,Mohammad Intakhab,5,It's a good platform to learn how to use AI tools from basic.,0,2026-02-27 00:41:34,2.0.9,"Hey there! 🤩 It's fantastic to hear that you find the platform beneficial for learning AI tools! Keep up the great work, and remember, the journey of learning is always exciting! Thank you for sharing your experience! 💙",2026-02-27 00:43:46
2026-04-17T21:41:13.894505+00:00,google_play,io.zimran.coursiv,Coursiv,primary,46ab5ecc-4b41-4060-9886-ad0727bf4649,Rodrigo C.,5,Good tutorials and lessons for the beginner who wants to understand AI.,0,2026-03-17 06:45:43,2.1.3,Hey there! 🤩 We're so excited to hear that you love the tutorials and lessons for beginners! Your feedback is truly inspiring and helps others take their first steps into the world of AI. Keep up the great work and continue your learning adventure! Thank you for sharing! 💙,2026-03-17 06:50:07
2026-04-17T21:41:13.894510+00:00,google_play,io.zimran.coursiv,Coursiv,primary,6b96713f-b854-40e9-8919-ab347973333d,Ibrahim Aliyu,5,"ChatGTP is a wonderful guide, assistant and enabler. It's flying me to other level of development and engagement.",0,2026-01-25 19:37:02,2.0.1,Hey there! 🤩 It's fantastic to hear that you're feeling empowered and inspired! Your enthusiasm for the development and engagement you're experiencing is truly uplifting. Keep that momentum going and continue to explore and learn! Thank you for sharing your wonderful feedback! 💫,2026-01-25 19:38:42
2026-04-17T21:41:13.894515+00:00,google_play,io.zimran.coursiv,Coursiv,primary,27d7789f-998f-4b41-93d3-778c59c579a8,Camica Johnson,5,love it and it simplifies the tools to understand their expertise. and in lesson exercises are perfect,0,2026-02-11 23:15:18,2.0.6,"Hey there! 🤩 It's fantastic to hear how much you appreciate the simplified tools and exercises! Your feedback is invaluable, and it's wonderful that you find them helpful for understanding the expertise. Keep enjoying your learning journey and exploring new horizons! 🚀",2026-02-11 23:19:33
2026-04-17T21:41:13.894519+00:00,google_play,io.zimran.coursiv,Coursiv,primary,3322042a-fbb7-423e-a7d7-0ddb4626fe01,Victoria Fagbemi,5,Very good app. I now have a better understanding of what AI tools are used for and how to use them.,0,2026-01-23 08:03:08,2.0.1,"We're delighted that our app has enhanced your understanding of AI tools! Your positive feedback means a lot to us, and it’s rewarding to know you’re finding value in learning how to use them effectively. If you have any questions or need further support, feel free to reach out. Thank you for sharing your experience! Best regards, Coursiv Team🚀",2026-01-23 08:08:32
2026-04-17T21:41:13.894524+00:00,google_play,io.zimran.coursiv,Coursiv,primary,c353d561-b41b-4930-bbf7-95a2a39d5ecf,Georgetown Poker Club,5,"Coursiv delivers simple, slick, and actually works.",0,2026-02-21 11:18:40,2.0.8,Hey there! 🤩 It’s fantastic to hear that you’re loving the app's simplicity and effectiveness! Your kind words truly inspire us to keep delivering an amazing experience. Keep exploring and learning with us—there’s always something new to discover! 💫,2026-02-21 11:23:55
2026-04-17T21:41:13.894530+00:00,google_play,io.zimran.coursiv,Coursiv,primary,cc07e5fa-c896-4a37-9534-3cfb7f7535a5,Atom Bomb,5,great course to get you up to speed with AI. its not going anywhere get on board now.,0,2026-02-15 08:48:54,2.0.8,"Hey there! 🤩 It's fantastic to know you're finding the course beneficial for getting up to speed with AI! Your encouragement to others is truly appreciated. Keep diving into this exciting world, and thank you for sharing your thoughts! 🚀",2026-02-15 08:53:19
2026-04-17T21:41:13.894534+00:00,google_play,io.zimran.coursiv,Coursiv,primary,eca3d42a-0b30-40c5-be40-1e7ac640ed3b,Kat Philbrook,5,I enjoy learning how each AI is used and which ones will work best for me.,0,2026-03-10 00:48:27,2.1.0,Hey there! 🤩 It's fantastic to hear you're enjoying the learning journey and discovering the best AI tools for you! Your feedback truly inspires us to keep delivering valuable insights. Keep up the great work and continue exploring! 🚀,2026-03-10 00:54:00
2026-04-17T21:41:13.894539+00:00,google_play,io.zimran.coursiv,Coursiv,primary,c8577d44-3c4a-45f2-ad5a-d7e0c5017774,Bev A.B.,5,Learning the AI tools through Coursiv is set at my pace and I would recommend it.,0,2026-02-25 09:12:16,2.0.9,"Hey there! 🤩 We’re so glad to hear that you’re enjoying the learning experience at your own pace! Your recommendation means the world to us. Keep up the great work, and continue exploring those AI tools! The journey of learning is always exciting! 🚀",2026-02-25 09:13:46
2026-04-17T21:41:13.894544+00:00,google_play,io.zimran.coursiv,Coursiv,primary,59962db8-8b4c-40ae-ac38-97ae831abd82,RJ Conners,5,it's easy to follow. it breaks it down for ease of learning,0,2026-02-20 07:43:11,2.0.8,Hey there! 🤩 We're so excited to hear that you find the lessons easy to follow and well-structured for learning! Your feedback truly brightens our day. Keep up the great work and continue your learning journey! Thank you for sharing your experience!,2026-02-20 07:49:02
2026-04-17T21:41:13.894548+00:00,google_play,io.zimran.coursiv,Coursiv,primary,8756c6e0-679c-455d-a13f-411c066d51a9,Tina Shearin,1,Hi .. I've tried to cancel my subscription for months .. please cancel this subscription.. How can I cancel this subscription now,1,2026-03-14 19:08:59,2.1.1,"Hi Tina Shearin, thank you for your feedback regarding your subscription cancellation. We’re here to help! Please contact us at support@coursiv.io for assistance with the process. We look forward to resolving this for you soon!",2026-03-14 19:15:26
2026-04-17T21:41:13.894553+00:00,google_play,io.zimran.coursiv,Coursiv,primary,74c100be-f562-41d4-91bc-c6339afe6584,Yahaya Babatunde S,5,Making learning easy and fun with detailed interactive video lectures,0,2026-03-16 09:25:52,2.1.3,"Hey there! 🤩 It’s fantastic to hear that you find learning both easy and enjoyable! Your feedback truly highlights the magic of our interactive video lectures, and we’re so grateful for your support in making education more engaging. Keep up the great work and continue your learning journey! Thank you for sharing!",2026-03-16 09:29:15
2026-04-17T21:41:13.894559+00:00,google_play,io.zimran.coursiv,Coursiv,primary,331a7d77-42f0-4383-9e53-7c34063dd9b2,Roanda Fivaz,5,Concise and detailed bite sized lessons. Easy to follow!,0,2026-03-10 19:16:15,2.1.2,"Hey there! 🤩 It's wonderful to see you enjoying the clear and detailed lessons! Your appreciation for the app's structure is invaluable, and we're excited to have you learning with us! Keep up the fantastic progress and keep reaching for the stars! 💫",2026-03-10 19:19:45
