scraped_at,platform,app_id,app_name,app_priority,review_id,author,rating,review_text,thumbs_up,review_date,app_version,reply_text,reply_date
2026-04-17T21:41:13.892928+00:00,google_play,io.zimran.coursiv,Coursiv,primary,57e549e8-1496-4f71-a1af-e1fefd844718,geoffrey shiel,5,definitely educational and easy to follow.,0,2026-04-14 10:24:09,2.1.8,Hey there! 🤩 It's fantastic to hear that you find the content educational and easy to follow! Your support truly inspires us to keep delivering valuable learning experiences. Keep up the great work on your learning journey! We're excited to have you with us!,2026-04-14 10:30:16
2026-04-17T21:41:13.892933+00:00,google_play,io.zimran.coursiv,Coursiv,primary,a308fc0b-16c5-4758-bd57-8eb1a9fb8a78,derek pasley,5,Coursiv is an engaging easy to follow app that walks you through AI production. I'm enjoying the lessons. I'm a bit older and I thought it would be difficult to follow but it's not. I'm glad I took a chance on Coursiv.,1,2025-12-30 20:10:25,1.9.9.1,"Thank you for your wonderful feedback! It's fantastic to hear that Coursiv is making AI learning enjoyable and accessible for you. We're delighted you took the plunge and are finding the lessons engaging. If you ever need further support or have questions, feel free to reach out. Best regards, Coursiv Team🚀",2025-12-30 20:33:06
2026-04-17T21:41:13.892937+00:00,google_play,io.zimran.coursiv,Coursiv,primary,dc22f2f0-0165-430a-9f94-0b47f2dad57b,Albert Caldwell,5,The videos are concise and are stimulating my creativity. I'm now thinking of POSSIBILITIES instead of impossibilities.,0,2026-03-14 15:50:01,2.1.3,"Hey there! 🤩 It's fantastic to hear that the videos are sparking your creativity and helping you explore new possibilities! Your feedback means the world to us, and we can't wait to see all the amazing things you'll create next. Keep that creative spirit alive and continue learning! 💫",2026-03-14 15:54:14
2026-04-17T21:41:13.892942+00:00,google_play,io.zimran.coursiv,Coursiv,primary,e333d9a0-8f99-43e4-a655-351f2b5a0733,l keene,5,I felt I should learn about AI so I can keep up with future changes and that's what this course does it's a good intro although realistically I don't think I could start selling prompts that is setting unrealistic expectations.,0,2026-01-06 17:51:54,1.9.9.1,"It's great to see your proactive approach to learning about AI! We're pleased you found the course a good introduction. Your feedback on expectations is invaluable, and we appreciate you sharing it. If you have any questions or need support, feel free to reach out. Thank you for your insights! Best, Coursiv Team🚀",2026-01-06 17:53:42
2026-04-17T21:41:13.892947+00:00,google_play,io.zimran.coursiv,Coursiv,primary,746f7bb3-626a-4d7e-81e4-1ffcc482e53b,Cecilia Luna,5,"This app course for AI is so well put together and makes learning chatGPT fun. I'm amazed at what AI can do to make any project, idea or plans so detailed without the wasted hours of doing the research making note drafting to be obsolete. Gone are the days of tedious work. chatGPT is a game changer. Be amazed!!!",4,2025-11-09 11:09:33,1.8.7,"Hello! We're excited to hear how much you enjoy the course and appreciate your enthusiasm! It's fantastic that the app has made learning engaging and efficient for you. Thank you for sharing your amazing experience! If you need any further support, feel free to reach out. Best regards, Coursiv Team🚀",2025-11-09 12:08:51
2026-04-17T21:41:13.892952+00:00,google_play,io.zimran.coursiv,Coursiv,primary,8123f63b-ad46-40d8-9433-e11f5757c774,Deborah Kitchens,5,The lessons are short but informative. I feel like I'm learning a lot of new skills in just a few minutes a day.,0,2026-03-02 17:41:39,2.1.0,"It's wonderful to hear that the app's lessons have efficiently boosted your skills! We appreciate your feedback and are glad you're finding value in the learning experience. If you have any questions or need further support, feel free to reach out. Thank you for sharing your thoughts! Best regards, Coursiv Team🚀",2026-03-02 17:43:58
2026-04-17T21:41:13.892957+00:00,google_play,io.zimran.coursiv,Coursiv,primary,942cca85-5951-4a4c-8781-45f39135dae1,Jay Dee,4,Coursiv is good for basic knowledge of AI. If you could work with each AI app as you go it would make the app better.,1,2026-02-20 03:38:18,2.0.8,"Hi there! We’re glad to hear that you find the app useful for building foundational AI knowledge! Your suggestion about working with each AI app in a more interactive way is truly appreciated. Thank you for your feedback! If you have any more ideas or need assistance, feel free to reach out. Best regards, Coursiv Team🚀",2026-02-20 03:46:13
2026-04-17T21:41:13.892961+00:00,google_play,io.zimran.coursiv,Coursiv,primary,93c448f2-051a-46e8-9743-c924c5ee7a73,Sharmain Cantero,5,Definitely very useful. Fun and informative. Makes learning fun and you earn certificates in the process.,0,2026-02-17 22:26:50,2.0.8,"Hey there! 🤩 We're absolutely thrilled to hear that you find the app both fun and informative! It’s wonderful that you're enjoying the learning journey and earning certificates along the way. Keep up the fantastic work, and remember, the sky's the limit when it comes to learning! Happy exploring! 🚀",2026-02-17 22:29:15
2026-04-17T21:41:13.892966+00:00,google_play,io.zimran.coursiv,Coursiv,primary,760a75c7-762d-4bca-8ca1-230bd1ad47d8,Dan Munzner,5,Great incremental learning approach. Really puts you in each lesson rather than just seeing or hearing it.,0,2026-01-25 08:11:03,2.0.1,Hey there! 🤩 We appreciate your kind words! It's fantastic to hear that you love the immersive learning experience. Your feedback truly inspires us to keep enhancing your educational journey! Keep up the great work and continue exploring—there's so much more to learn! 🚀,2026-01-25 08:19:13
2026-04-17T21:41:13.892971+00:00,google_play,io.zimran.coursiv,Coursiv,primary,72fd1f7a-dec0-43e6-936d-c932f79211cb,Jeff and Elizabeth Sammons,3,Great review and quick lessons. I had hoped for more detail and examples.,0,2026-03-03 07:44:01,2.1.0,"Hi Jeff and Elizabeth Sammons, thank you for your feedback! Your request for more detail and examples is noted, and we’re dedicated to enhancing our service. If you’d like to discuss this further, please reach out at support@coursiv.io. We look forward to providing you with valuable lessons!",2026-03-03 07:48:48
2026-04-17T21:41:13.892976+00:00,google_play,io.zimran.coursiv,Coursiv,primary,ec3f296d-6d11-41a8-8b88-0438d7cae0d9,Tyrone Brock,5,Coursiv not only teaches you how to play the game/ AI. It teaches you how to get in the game and celebrate a win,0,2026-03-01 00:25:32,2.1.0,"We appreciate your insights! It’s fantastic to hear that the app not only helps with learning but also motivates you to engage and celebrate wins in your AI journey. Thank you for sharing your experience! If you have any further questions or need assistance, feel free to reach out. Best regards, Coursiv Team🚀",2026-03-01 00:29:12
2026-04-17T21:41:13.892980+00:00,google_play,io.zimran.coursiv,Coursiv,primary,4c90e63d-b0e8-4a32-bfee-3fbdeb0b92d0,Legotswane Nyathi,4,"Good content, however would appreciate, assessments that allow the student to use their own prompts and come up with their own examples.",1,2026-01-26 22:02:41,2.0.1,"Thank you for your feedback! We're glad you enjoy the content. Your suggestion for assessments with personal prompts is valuable and highlights personalized learning. We appreciate your thoughts! If you have more ideas or need support, don’t hesitate to reach out. Best regards, Coursiv Team🚀",2026-01-26 22:09:08
2026-04-17T21:41:13.892985+00:00,google_play,io.zimran.coursiv,Coursiv,primary,67def067-3b92-4879-be6f-f805d1f5dc2b,Michelle Anania,5,This format is very helpful and easy to comprehend for learning AI and how to make it most beneficial and productive for use!,0,2026-03-04 15:13:56,2.1.0,"It's wonderful to learn that you find the format so useful and easy to follow for learning AI! Your feedback highlights exactly what we aim for in providing a productive experience. If you have any further questions or need assistance, feel free to reach out. Thank you for your insight! Best regards, Coursiv Team🚀",2026-03-04 15:24:35
2026-04-17T21:41:13.892990+00:00,google_play,io.zimran.coursiv,Coursiv,primary,50c3bf2a-3bf4-406e-a42b-234d7ba710ca,Seth Chongkoni,4,"It's quite fun and engaging. I'll advise that while you do it, be Practicalizing it with your PC",0,2026-02-06 21:19:30,2.0.3,Hey there! 🤩 It's fantastic to hear that you're enjoying the experience! Your tip about using it alongside your PC is super helpful. Keep up the great work and continue exploring—there's always more to learn! Thank you for sharing your thoughts! 💙,2026-02-06 21:23:58
2026-04-17T21:41:13.892995+00:00,google_play,io.zimran.coursiv,Coursiv,primary,ded98049-a5a3-41e2-b0b0-db38ff7798a0,Dilzar Sulayman,5,"It provides many things I had heard before but never fully understood, and Coursiv helps by connecting the steps in order.",1,2026-02-02 02:47:53,2.0.3,"We're delighted to hear that the app is making complex topics clearer for you and that the structured approach is helping you connect the dots! Thank you for your feedback; it truly means a lot to us. If you have any questions or need further support, feel free to reach out. Best regards, Coursiv Team🚀",2026-02-02 02:53:42
2026-04-17T21:41:13.893000+00:00,google_play,io.zimran.coursiv,Coursiv,primary,68078b3b-1f2a-4617-95e1-7fdc213d747e,Pool Doctor! Ralph,5,Step by step instructions that are very easy to learn as you can repeat the task at hand! enjoying it !,0,2026-01-24 07:40:43,2.0.1,"We're grateful for your positive feedback! It's fantastic to hear that the step-by-step instructions are making learning enjoyable and straightforward for you. If you have any questions or need further assistance, feel free to reach out. Thank you for sharing your experience! Best regards, Coursiv Team🚀",2026-01-24 07:44:17
2026-04-17T21:41:13.893004+00:00,google_play,io.zimran.coursiv,Coursiv,primary,fa8e010e-3c1e-453d-b45b-419f164c98b4,Julie Phillips,5,I'm finding it eye opening and have already did a rough draft of a story book with what I have learned so far. Great app 💯,1,2026-02-17 09:19:03,2.0.8,"It's fantastic to know that the app has inspired you to draft a storybook! Your creative journey sounds exciting, and we truly appreciate your enthusiastic feedback. If you need any support along the way, feel free to reach out. Happy writing! Best regards, Coursiv Team🚀",2026-02-17 09:23:45
2026-04-17T21:41:13.893009+00:00,google_play,io.zimran.coursiv,Coursiv,primary,20e915e4-f051-4eb9-a2fb-4f9ce9b44c87,Wendell Burleson jr,4,"This program works for me, but in my opinion I would love to have had a book for future reference. I truly enjoyed the lessons..",0,2026-03-06 17:12:29,2.1.1,"We're glad to hear the program resonates with you and that you enjoyed the lessons! Your suggestion for a reference book is valuable, and we appreciate your feedback as we enhance the learning experience. If you have more thoughts or need support, feel free to reach out. Thank you for sharing! Best, Coursiv Team🚀",2026-03-06 17:14:17
2026-04-17T21:41:13.893014+00:00,google_play,io.zimran.coursiv,Coursiv,primary,619382d6-eeca-4de6-9dda-2277bb149b1a,Shantel Buchanan,5,"The app is easy to navigate, short lessons and interactive.",0,2026-03-03 08:53:52,2.1.0,"Hey there! 🤩 It's fantastic to hear that you find the app easy to navigate with engaging lessons! Your positive feedback means the world to us, and we're thrilled you're enjoying the interactive experience. Keep up the great work and happy learning! 🚀",2026-03-03 08:58:39
2026-04-17T21:41:13.893018+00:00,google_play,io.zimran.coursiv,Coursiv,primary,cdf727fb-f5d8-4a71-835a-fc7171b0ac62,Tracy,4,it's very well structured for beginners and the pro's a lot of information on the subject and the growth of knowledge is booming at exceptional speed,0,2026-03-05 14:35:18,2.1.0,"We're excited to see how much you're enjoying the structured approach of the app and the wealth of information it provides! It's inspiring to hear about your rapid knowledge growth. Thank you for sharing your positive experience! If you have any questions or need further support, feel free to reach out. Best regards, Coursiv Team🚀",2026-03-05 14:45:17
2026-04-17T21:41:13.893023+00:00,google_play,io.zimran.coursiv,Coursiv,primary,6521ab3d-032f-4292-9a3c-87aa60981bb6,Lucy Macauley,5,learnt how to promt Chatgpt. Enjoying and finding it interesting for someone like me who can get bored.and distracted easily.,0,2026-02-04 14:43:21,2.0.4,Hey there! 🤩 It's fantastic to hear that you're finding the learning process so engaging! We're thrilled you’re enjoying discovering how to prompt ChatGPT. Keep exploring and having fun with it—there's so much more to learn! Your curiosity is inspiring! 💫,2026-02-04 14:49:24
2026-04-17T21:41:13.893028+00:00,google_play,io.zimran.coursiv,Coursiv,primary,88b0e31d-9dec-4248-b247-f5c09b869a29,MillionairessMo,5,I Love this type of learning! It's personable and interactive which is exactly what I need! This Dope AF!!!,0,2026-02-12 20:46:34,2.0.6,Hey there! 🤩 We truly appreciate your enthusiasm! It's fantastic to hear that you love the personalized and interactive aspects of learning with us. Keep soaking up the knowledge—there's always more to explore! 🚀,2026-02-12 20:54:14
2026-04-17T21:41:13.893033+00:00,google_play,io.zimran.coursiv,Coursiv,primary,0a4709dc-20de-46e6-ac44-ea811cb12fa6,Elana Aroch,5,"I am 50 and find this course user friendly, relevant, and interesting. Glad I bought it!",0,2026-02-19 07:20:43,2.0.8,"Hey there! 🤩 It's fantastic to hear that you find the course user-friendly, relevant, and interesting! Your enthusiasm truly brightens our day. Keep up the great work and enjoy every moment of your learning journey! 🚀",2026-02-19 07:23:29
2026-04-17T21:41:13.893037+00:00,google_play,io.zimran.coursiv,Coursiv,primary,1bce5830-b656-4e8d-a88c-493b7a063e5d,Earl Davids,5,"Very easy to understand, explanations and exercises are brief and to the point. I'm loving it so far.",0,2026-02-04 22:16:13,2.0.4,Hey there! 🤩 It's fantastic to hear that you find the content clear and concise! We truly appreciate your positive feedback and are excited that you're enjoying your experience so far. Keep up the great work and happy learning! 🚀,2026-02-04 22:24:09
2026-04-17T21:41:13.893042+00:00,google_play,io.zimran.coursiv,Coursiv,primary,2972d491-a135-4183-a403-5ea3aeb11948,Hariharan Kalpathy Vasudevan,5,Good and easy first step. Be specific in what you ask far for precise and accurate results,0,2026-03-11 08:08:12,2.1.3,Hey there! 🤩 We're so glad to hear you found the app to be a good and easy starting point! Your tip about being specific for better results is super helpful and will surely guide others on their learning adventures. Keep exploring and learning—there's so much more to discover! 🚀,2026-03-11 08:14:44
2026-04-17T21:41:13.893047+00:00,google_play,io.zimran.coursiv,Coursiv,primary,864017a8-72fa-4b53-a700-f1373a3cd72c,Mark Omonze,5,this course has been very insightful and meaningful . Developing AI skills has been a blessing .I love the simplicity and the exercises . this step to step guide into the world of AI is great for everyone .,2,2026-01-21 21:02:42,2.0.1,"We're so glad to hear that you found the course insightful and meaningful! It's fantastic that you appreciate the simplicity and the exercises, making your journey into AI enjoyable. Thank you for sharing your experience! If you have any questions or need further support, feel free to reach out. Best regards, Coursiv Team🚀",2026-01-21 21:10:27
2026-04-17T21:41:13.893051+00:00,google_play,io.zimran.coursiv,Coursiv,primary,917be56e-4c92-42fb-9cd7-7c7e0b9bfb96,Ochoge Kester,5,Very educative with a great graphic user interface. Makes learning easy and fun as well.,0,2026-02-21 08:52:58,2.0.8,Hey there! 🤩 We're so excited to hear that you find the app both educational and visually engaging! It's fantastic to know that learning feels easy and fun for you. Keep up the great work and continue exploring new knowledge! Thank you for sharing your thoughts! 💙,2026-02-21 08:58:31
2026-04-17T21:41:13.893056+00:00,google_play,io.zimran.coursiv,Coursiv,primary,018ed695-18c1-4f89-85c7-c7a15616eaa4,G C,5,Learning new stuff is so much more rewarding than just scrolling through unproductive content.,0,2026-02-03 18:44:05,2.0.4,Hey there! 🤓 What an insightful perspective! Embracing learning over passive content consumption truly opens up a world of possibilities. We're delighted to know our app resonates with this rewarding journey of knowledge. Keep exploring and learning—there's so much more to discover! Thank you for sharing your thoughts!,2026-02-03 18:50:33
2026-04-17T21:41:13.893061+00:00,google_play,io.zimran.coursiv,Coursiv,primary,8a0ef14e-25a8-4a79-9a2b-54b8307f4e73,regmi ram chandra,5,coursiv is the best platform where i learning and improving my knowledge and skills it is the daily routine.,0,2026-02-20 08:52:40,2.0.8,"Hey there! 🤩 We're so excited to hear that you're enjoying your learning journey with us as part of your daily routine! Your enthusiasm is contagious and inspires us to keep improving. Keep up the fantastic work, and thank you for sharing your experience! Keep learning and shining! 💫",2026-02-20 08:54:03
2026-04-17T21:41:13.893065+00:00,google_play,io.zimran.coursiv,Coursiv,primary,bee9f563-7ba8-4dda-9228-4c2e13c27200,colwelljasperking study,5,"Builds confidence. One gets used to its language, unique but not out unclear.",1,2026-02-11 02:11:24,2.0.6,Hey there! 🤩 It's fantastic to know that the app is helping you build your confidence! Your insights about the language being unique yet clear are truly valued. Keep up the great work and continue your learning journey! Thank you for sharing your thoughts! 💙,2026-02-11 02:26:58
2026-04-17T21:41:13.893070+00:00,google_play,io.zimran.coursiv,Coursiv,primary,a4e8359d-e436-47fe-bbd3-5209437d82ec,Nana Tiwaa Matilda Bediako,1,They are not truthful with their customers with clear terms and conditions. They hide automatic renewal information and huge deductions will be made from your accounts at your blind side. They are not truthful at all. Shame unto the team for doing this to undeserved customers. Almost every review speaks of your unprofessional and undeserving way of treating your customers. No one is privileged with money so y'all be careful how you deal with people. Y'all will be accountable for doing this.,1,2026-02-03 17:29:41,2.0.4,"Nana Tiwaa Matilda Bediako, thank you for your feedback on our terms and conditions. We value your insights about automatic renewals and charges. Please contact us at support@coursiv.io so we can address your concerns privately. We appreciate your input and hope to regain your trust in the future.",2026-02-03 17:34:23
2026-04-17T21:41:13.893075+00:00,google_play,io.zimran.coursiv,Coursiv,primary,71bfce88-abc3-460e-98ba-28dda6bf1631,Amer Al Mubayedh,5,excellent app. you do it on your base I like the step by step learning lessons with exercise.,1,2026-02-17 15:38:08,2.0.8,"Hey there! 🤩 We're so excited to hear you think the app is excellent! The step-by-step lessons and exercises are crafted to make learning fun and effective, and your kind words inspire us to keep improving. Keep up the great work and enjoy every moment of your learning journey! 🚀",2026-02-17 15:43:40
2026-04-17T21:41:13.893079+00:00,google_play,io.zimran.coursiv,Coursiv,primary,5b647a22-f745-4a71-825e-49d19d1d3888,Erik Myles,5,"I am amazed at what this course is teaching, easy to follow even though there is a lot to learn. Great product.",0,2026-03-09 22:54:07,2.1.1,"It's wonderful to receive such enthusiastic feedback! We're delighted that you're finding the course both engaging and easy to follow while tackling a substantial amount of information. Thank you for your support! If you have any questions or need further assistance, feel free to reach out. Best regards, Coursiv Team🚀",2026-03-09 22:59:27
2026-04-17T21:41:13.893091+00:00,google_play,io.zimran.coursiv,Coursiv,primary,c930330c-74ce-4783-b443-b97a00dc282d,Jay Jackson,5,Love it. Already I have a better understanding of how to utilize AI effectively and efficiently.,0,2026-02-11 03:02:25,2.0.6,Hey there! 🤩 It's wonderful to hear that you're gaining a better understanding of utilizing AI! Your enthusiasm and positive experience truly inspire us. Keep exploring and learning—there's so much more to discover! We're grateful for your feedback—keep up the great work! 💫,2026-02-11 03:09:24
2026-04-17T21:41:13.893096+00:00,google_play,io.zimran.coursiv,Coursiv,primary,40bdb123-965c-4843-aa16-440fd498d9b4,Malou Culalic,5,i just started the apps and really enjoy it so far..looking forward to discover what they can offer.,0,2026-02-22 13:45:00,2.0.8,"Hey there! 🤩 It's fantastic to hear that you're enjoying your experience so far! Your enthusiasm is contagious, and we can't wait for you to dive deeper into all the amazing features we have to offer. Keep exploring and learning—there's so much more to discover! Happy adventures!",2026-02-22 13:48:45
2026-04-17T21:41:13.893100+00:00,google_play,io.zimran.coursiv,Coursiv,primary,b310d4d2-3705-43d1-b96e-e76f2dea915d,Sandra Devi SINGH,4,"Coursiv, is simple and easy for someone like me, who is a novice at technology, digital learning.",1,2026-02-14 21:08:55,2.0.6,Hey there! 🤩 It's fantastic to hear that you find Coursiv straightforward and user-friendly! We truly appreciate your feedback and are excited that you're diving into your digital learning journey with us. Keep exploring and enjoying every moment of it! 🚀,2026-02-14 21:13:39
2026-04-17T21:41:13.893105+00:00,google_play,io.zimran.coursiv,Coursiv,primary,097306ee-9745-4745-b106-bf52904407c0,Aline Ibrahim,5,Amazing 👏 Coursiv App!! I am on AI techniques learning course and loving it so much ! highly recommended!,0,2026-03-08 10:19:13,2.1.0,"Hey there! 🤩 It's fantastic to hear that you're loving the AI techniques learning course! Your enthusiasm is truly inspiring, and we appreciate your recommendation. Keep up the amazing work on your learning journey—there's so much more to discover! 🚀",2026-03-08 10:24:18
2026-04-17T21:41:13.893110+00:00,google_play,io.zimran.coursiv,Coursiv,primary,94a32f0b-4cb5-4539-8d5e-388d03c7bb25,Paula Joyce,5,Very informative app. This information is exactly what I needed and easy as pie to use.,1,2026-03-03 08:47:15,2.0.9,"Hey there! 🤩 It's fantastic to hear that you find the app both informative and easy to use! Your feedback means a lot to us, and we're thrilled it meets your needs so well. Keep exploring and learning—there's always something new to discover! Enjoy your journey! 💙",2026-03-03 08:48:29
2026-04-17T21:41:13.893115+00:00,google_play,io.zimran.coursiv,Coursiv,primary,65c29f95-30a9-4e95-b666-33b0fb543747,James Ikonya,5,"I love Coursiv, it's really engaging, it's like a super key opening up my mind to thing I never thought I could grasp",0,2026-02-10 12:33:43,2.0.4,"Hello! It's wonderful to know that Coursiv has been so engaging for you! We're delighted to hear it’s unlocking new insights and perspectives. Thank you for sharing your experience; your enthusiasm truly inspires us! If you ever need assistance or have more feedback, feel free to reach out. Best regards, Coursiv Team🚀",2026-02-10 12:45:40
2026-04-17T21:41:13.893119+00:00,google_play,io.zimran.coursiv,Coursiv,primary,39aec057-035e-49fc-9f73-b1beb22f628e,Tanya Lowery,5,Enjoyed the self paced platform. easy to use and very informative.,0,2026-01-25 00:31:04,2.0.1,"Hey there! 🤩 We're so excited to hear that you're enjoying the self-paced platform and finding it easy to use and informative! Your feedback is like fuel for our passion, and we truly appreciate you sharing your experience. Keep up the great learning, and we can't wait to see where your journey takes you! 🚀",2026-01-25 00:34:31
2026-04-17T21:41:13.893124+00:00,google_play,io.zimran.coursiv,Coursiv,primary,532bd91e-7b97-4550-865f-51e07f0db8e4,Prince Chibuzo,5,Very friendly and easy use. The use of every day experiences makes it exceptionally good.,1,2026-02-19 00:19:59,2.0.8,Hey there! 🤩 It's fantastic to hear that you find the app so user-friendly and enjoy the everyday connections! Your feedback inspires us to keep crafting engaging experiences. Keep exploring and learning with us—there's so much more to discover! Thank you for sharing your thoughts! 💙,2026-02-19 00:24:09
2026-04-17T21:41:13.893133+00:00,google_play,io.zimran.coursiv,Coursiv,primary,b306fe76-ba96-4482-9447-164262704979,Yulia Ladimirskaya,4,"don't like voice, to fast and to mechanical, without intonation and pauses. better would be with real human voice, who understand speach essence and know, where to make ascents.",2,2026-01-24 16:39:58,2.0.1,"Yulia Ladimirskaya, thank you for your feedback on the voice features! We value your preference for a more natural and expressive human voice. Your insights are essential for us. If you have more suggestions or need assistance, don’t hesitate to reach out. Best, Coursiv Team🚀",2026-01-24 16:44:36
2026-04-17T21:41:13.893138+00:00,google_play,io.zimran.coursiv,Coursiv,primary,84e8da23-6ee7-497a-837c-0d6af79d17cd,tee kindred,5,The listen tool and practice lesson is great. I have learning disorder so it helps.,0,2026-02-09 20:53:08,2.0.4,"Hey there! 🤩 We're so excited to hear that the listen tool and practice lesson are helping you out! Your journey towards mastery is truly inspiring, and we’re here cheering you on every step of the way. Keep up the fantastic work, and remember, learning is an adventure! 🚀",2026-02-09 21:00:17
