page_name,keyword_count,total_ads,max_days_running,keyword_categories,keywords_matched,competitor_tier,sample_ad_copy
Amazon Web Services,3,33,96,pain,AI no coding|AI overwhelmed|learn AI,ADJACENT,"Every developer has THAT debugging story - the one that still gives them nightmares.

We asked #developers about their worst debugging experiences and"
Coursera,2,12,59,pain,AI no coding|learn AI,ADJACENT,{{product.brand}}
WhatChimp,2,10,155,pain,AI no coding|learn AI,ADJACENT,{{product.brand}}
Udemy,2,9,120,pain,AI no coding|learn AI,ADJACENT,"Transform your career with Learn AI with Google, available on Udemy. 

Whether you're starting from scratch or looking to level up, this comprehensive"
AWSDevelopers,2,8,22,pain,AI no coding|learn AI,ADJACENT,"⭐️ Do you want to be an AI-first engineer? You'll need to know what MCP is! 🚀 (Part 5 of becoming an AI-first engineer series)

Model Context Protocol"
Google Workspace,2,3,19,pain,AI no coding|learn AI,ADJACENT,"Check out all the Workspace Drops from hashtag#GoogleCloudNext.

Learn about AI built for the reality of how you work every day. These announcements r"
Outskill,2,3,56,pain,AI no coding|learn AI,ADJACENT,{{product.brand}}
Google,2,2,16,pain,AI no coding|learn AI,ADJACENT,Do more with Google Gemini: Your everyday AI companion
Kiro,2,2,15,pain,AI no coding|learn AI,ADJACENT,"What if you could experiment without fear?

Checkpointing lets your AI assistant tackle ambitious refactors, knowing you could instantly rewind if thi"
OpenAI,1,22,12,pain,AI no coding,WEAK,{{product.brand}}
Ayatique,1,14,99,pain,AI overwhelmed,WEAK,"Feeling overwhelmed? Take a moment with Quran Stories.

Calming audio reminders of divine wisdom — anytime you need peace.

💚 No screens. No pressure."
Codingal,1,11,178,pain,AI no coding,WEAK,{{product.brand}}
Cisco Networking Academy,1,6,60,pain,learn AI,WEAK,Discover how AI can simplify your daily tasks and boost productivity. Join our free course: Introduction to Modern AI.
AT&T,1,5,37,pain,learn AI,WEAK,{{product.brand}}
Alibaba Cloud,1,4,7,pain,AI no coding,WEAK,"Qwen3.6-Plus is now live on OpenRouter and free to try for a limited time!
Experience the future of agentic AI with Qwen3.6-Plus, now available on Ope"
Learn with Cisco,1,3,21,pain,learn AI,WEAK,"Learn how to leverage AI in networking, cybersecurity, data center, and design with Cisco."
Cohere AI,1,3,42,pain,learn AI,WEAK,{{product.brand}}
BrightCHAMPS,1,3,6,pain,AI no coding,WEAK,"🚀 Give Your Child the Edge with Future-Ready Coding Skills!
Designed by alumni from Harvard, NYU Stern & IIM Calcutta, BrightChamps' live 1-on-1 codin"
Tony Robbins,1,3,15,pain,AI overwhelmed,WEAK,"HERE'S THE TRUTH THAT NOBODY WANTS TO SAY OUT LOUD: You won't get replaced by AI. You'll get replaced by someone who understands how to use it.

The f"
Meta for Developers,1,2,3,pain,learn AI,WEAK,Join us for the Developer Keynote of Meta Connect 2025 — our annual conference where we showcase our progress in building the future of human connecti
AORUS,1,2,18,pain,learn AI,WEAK,"RTX 5060 Ti #AIBOX brings desktop-class performance to your everyday setup: plug in, power up, and elevate gaming, AI workloads, or creative tasks wit"
NVIDIA,1,2,5,pain,learn AI,WEAK,"Watch our CEO Jensen Huang outline the blueprint for America’s AI century in Washington, D.C. at #NVIDIAGTC.

From national AI infrastructure and quan"
Novitech R&D Pvt Ltd,1,2,149,pain,learn AI,WEAK,{{product.brand}}
"Alex Mehr, Ph.D.",1,2,200,pain,AI no coding,WEAK,{{product.brand}}
Langflow ,1,2,85,pain,AI no coding,WEAK,"The biggest AI competition is about to start! Subscribe with your GitHub account! 🌟

To find talents and foster the open-source community, Langflow is"
Code With Harry,1,2,114,pain,AI no coding,WEAK,Learn Data Analytics with AI
Magoosh,1,2,93,pain,AI overwhelmed,WEAK,{{product.brand}}
Tyler Tometich,1,2,50,pain,AI overwhelmed,WEAK,"Are you tired of your videos getting lost in the endless sea of social media? 

🚀 **It's Not Too Late - The Gap is Real, But So is the Solution!**

I'"
TikTok - US,1,1,265,pain,learn AI,WEAK,Find content that fits your interests. Get TikTok.
MultiLingual AI Learn,1,1,84,pain,learn AI,WEAK,Kostenloser KI-Konversationstutor! Lerne jede Sprache – wähle einfach deine liebste aus!
Call to Leap,1,1,358,pain,learn AI,WEAK,"The #1 mistake most homebuyers make is that they don’t shop for mortgage rates! Go to OwnUp.com to check for FREE! #ownuppartner

Follow @calltoleap i"
SkillCourse By Satish Dhawale,1,1,244,pain,learn AI,WEAK,"Introducing the 30-Day Excel Micro Course: Learn Excel with AI in just 99/-! 🚀 
📊 Master essential skills like data entry, basic formulas, and advance"
IBM,1,1,41,pain,learn AI,WEAK,Manage AI agents and assistants from a single interface in a single location. Learn more.
Nolae,1,1,304,pain,learn AI,WEAK,"Buying K-Pop products has never been easier 🤗
No customs & shipping from Germany 🥳"
Lowe's Home Improvement,1,1,61,pain,learn AI,WEAK,"Today, we’re introducing the newest member of our team: Mylow. Developed in collaboration with OpenAI, Mylow delivers the expertise of a trusted Red V"
MSI Gaming,1,1,21,pain,learn AI,WEAK,"RTX. It’s ON. 🔥
Saatnya upgrade ke laptop MSI terbaru dengan GeForce RTX™ 50 Series 🚀

Rasakan performa next-gen dengan:
✨ DLSS 4 – FPS makin kencang "
Dataiku,1,1,314,pain,learn AI,WEAK,{{product.brand}}
Globe Telecom,1,1,13,pain,learn AI,WEAK,"More ways to do what you love everydAI with Go+99 now with AI. 💙 Enjoy 20GB total data and spark ideas with Canva’s AI tool, now available with GoLEAR"
Sarina Searches,1,1,46,pain,learn AI,WEAK,Unlock the future with AI! 🤖 Dive into Google’s online courses and start your journey in artificial intelligence.
International Jazz Day,1,1,15,pain,learn AI,WEAK,"As part of Culture Summit Abu Dhabi 2025, this International Jazz Day conversation with John Ridding, CEO of the Financial Times, explores Herbie Hanc"
AWS Public Sector,1,1,2,pain,learn AI,WEAK,"✨ We just announced 39 remarkable nonprofit organizations as winners of our 2025-2026 AWS Imagine Grant, spanning six countries across three continent"
Wasabi Technologies,1,1,8,pain,learn AI,WEAK,"AI compute is garnering lots of attention. But it’s storage that determines how far you can go. ☁️

Here's why storage is the unsung hero of the AI re"
LuxAlgo,1,1,46,pain,learn AI,WEAK,"Start trading like smart money. Our AI Backtesting platform finds trading strategies you can COPY & PASTE into TradingView.

Backtest in minutes, not "
Adobe Creative Cloud,1,1,35,pain,learn AI,WEAK,Save on the ultimate creative toolkit including 20+ apps and generative AI features. First 3 months only. Terms apply.
Atlassian,1,1,26,pain,learn AI,WEAK,"It’s not often that we discuss topics as monumental as *the future of everything.* But when we do, it’s with Mike Cannon-Brookes. 

There’s a reason A"
Discovery South Africa,1,1,1,pain,learn AI,WEAK,Track your spending habits and get rich analytical insights with Discovery AI.
Supermicro,1,1,38,pain,learn AI,WEAK,"Supermicro has collaborated with @Applied_Digital, a leader in next-gen cloud services, to revolutionize AI and High-Performance Computing (HPC) workl"
Siemens,1,1,167,pain,learn AI,WEAK,"From smart buildings to AI, Siemens drives progress in business and everyday life. Learn more 👇"
Microsoft Azure,1,1,13,pain,learn AI,WEAK,{{product.brand}}
Life in Germany,1,1,7,pain,learn AI,WEAK,"Ever wondered what actually happens when you visit a doctor or dentist in Germany? 🇩🇪🦷

I’ll walk you through the full process, from showing your heal"
Omneky,1,1,98,pain,learn AI,WEAK,"Your best-performing ad is one you haven't tested yet. But creating dozens of variations is slow and expensive, limiting your ability to scale.

Our g"
Expert Edu Search,1,1,115,pain,learn AI,WEAK,Learn key AI concepts including machine learning through Google's online course. Anyone worldwide can develop valuable tech knowledge at their own pac
FreightWaves,1,1,5,pain,learn AI,WEAK,"PCS’s Chief Product Officer Danielle Viegas joins FreightWaves to discuss Cortex, PCS’s AI platform, and how it’s shaping the future of freight after "
"The Rapacke Law Group, P.A.",1,1,0,pain,learn AI,WEAK,"Your Innovative Use of AI Could Be a Competitor's Next Profit Machine, Unless...

You take the proper steps to protect your valuable intellectual prop"
Cisco Live EMEA,1,1,1,pain,learn AI,WEAK,"☕ Final broadcast morning in Amsterdam – our last day streaming live from #CiscoLiveEMEA has now kicked off!

Savor these closing sessions: standout i"
EE Times - Electronic Engineering Times,1,1,389,pain,learn AI,WEAK,Stay up to date on the electronics industry's latest technologies with EE Times tech papers. Download Now!
Grammarly,1,1,46,pain,learn AI,WEAK,If you thought Grammarly had peaked...plot twist. Our new writing surface has AI agents built to help with every stage of your writing assignment.
gomycode,1,1,761,pain,learn AI,WEAK,"Bonjour, je suis @sghaier_amal , étudiante en développement FullStack à GOMYCODE🔥
J'ai obtenu ma licence en gestion des entreprises agricoles et un ma"
Microsoft Learn,1,1,14,pain,learn AI,WEAK,"AI-powered podcasts and summaries help you learn faster. Visit AI Skills Navigator today.
Your time matters. AI Skills Navigator turns dense modules i"
Content Creator.com,1,1,17,pain,learn AI,WEAK,"Ready to master viral AI visual effects & filmmaking the easy way? Do this 👇🏻

Even if you have NO EXPERIENCE, all you need is a laptop and a couple h"
Coding Ninjas,1,1,159,pain,AI no coding,WEAK,{{product.brand}}
One For All Project,1,1,538,pain,AI no coding,WEAK,"I am not here to sell you anything, only to offer you my time and a space of selfless love to knowledge. Join a physicist on a quest to unravel the se"
Emergent Labs,1,1,45,pain,AI no coding,WEAK,"No tech skills? No problem. 
🆓It's free to try! 

Our easy-to-use no-code platform lets you design, customize, and launch your mobile app faster than "
Shobhit University India,1,1,147,pain,AI no coding,WEAK,"Build the Future with Code!
At Shobhit University, our B.Tech in Computer Science & Engineering (CSE) is designed to shape innovators and problem-solv"
WordPress,1,1,8,pain,AI no coding,WEAK,"State of the Word 2025 has come and gone, but the story doesn’t end there. Catch the full keynote replay, the ideas, the demos, and the community mome"
Best Trending Shows ,1,1,19,pain,AI no coding,WEAK,Watch Top Trending Shows on StoryTV !
Softwarewithnick,1,1,32,pain,AI no coding,WEAK,"#ColumbiaPlusPartner Free Machine Learning course from Columbia+ 😎

Columbia+ is the online extension of Columbia University in New York. Now you have"
Airia ,1,1,33,pain,AI no coding,WEAK,"Build an AI agent in under 67 seconds—without writing a single line of code.

With Airia, you can connect models, plug in your data, use pre-built pro"
Lenovo,1,1,7,pain,AI no coding,WEAK,"Purpose-built for the AI era, the Lenovo ThinkBook VertiFlex Concept.

Featuring a 14” pivoting display - enhancing your view for coding, reading, & m"
slashdevhq,1,1,78,pain,AI no coding,WEAK,"Gemini Hidden Features Day 2

Stopped wasting hours on YouTube tutorials. Just drop the YouTube link → get a perfect step-by-step guide.

#GeminiAI #D"
Clinilaunch Research Institute,1,1,69,pain,AI no coding,WEAK,"CliniLaunch is a leading institute for healthcare training and certification. It offers online and offline courses in clinical research, medical codin"
Università degli Studi Guglielmo Marconi,1,1,169,pain,AI no coding,WEAK,"Do you want more than just coding? 

Our Master in Computer Science gives you the tools to build impactful tech solutions with sustainability, ethical"
EIPASS,1,1,129,pain,AI no coding,WEAK,{{product.brand}}
Jess Ramos Data,1,1,23,pain,AI no coding,WEAK,"Save these steps on how to move your data from @chatgpt to @claudeai:

Follow @jessramosdata for more data & AI!

1. Export your ChatGPT data: Setting"
IITM Pravartak - Online Certificate Programs with Coding Ninjas,1,1,25,pain,AI no coding,WEAK,{{product.brand}}
PW Skills by PhysicsWallah,1,1,237,pain,AI no coding,WEAK,{{product.brand}}
Cursor,1,1,41,pain,AI no coding,WEAK,"What if you could build a game with a game controller?

We tried it.

Raspberry Pi + Bluetooth controller + Cursor.

A few minutes later, a working ga"
TechTip24 Edu,1,1,70,pain,AI no coding,WEAK,"Master Business Analysis using Power BI at just Rs 49/-

Tired of feeling stuck in your current job? 😩
The Data Analytics field is booming, but withou"
Snap Lens Studio,1,1,10,pain,AI no coding,WEAK,"If you can imagine it, you can build it in Lens Studio 🙌
Take it from #Snappys nominee Ben Knutson live from the yellow carpet: “gets easier and easie"
Mixo,1,1,16,pain,AI no coding,WEAK,{{product.brand}}
"St. Joan’s School, Salt Lake",1,1,76,pain,AI no coding,WEAK,"🚀 SHAPE THE FUTURE. DON’T JUST STUDY IT.

Artificial Intelligence (AI) – ISC | Classes XI & XII

The world is run by algorithms.
The future will be le"
McGraw Hill International,1,1,14,pain,AI no coding,WEAK,"85% of jobs in 2030 will require AI fluency.

Yet only 15% of international schools teach AI literacy across all grades.

The gap isn't just about tea"
MarketingBlocks,1,1,276,pain,AI no coding,WEAK,"In today's fast-paced world, your online business success hinges on speed & execution. 

If you waste too much time planning, you fall behind & lose o"
AI News,1,1,55,pain,AI overwhelmed,WEAK,{{product.brand}}
Kittl,1,1,127,pain,AI overwhelmed,WEAK,"Overwhelmed By The Idea of Starting A Print-on-Demand Store?

Make your life easier with Kittl. Create a logo with AI and design your first T-shirt by"
Beliine Plate,1,1,68,pain,AI overwhelmed,WEAK,Read informational insights on how AI courses from Google help learners strengthen digital and analytical skills. Learn how structured modules support
Gaia,1,1,33,pain,AI overwhelmed,WEAK,"You don’t need another resolution. You need a reset. ⚡

This New Year, change the frequency you live from — not just the habits you promise to keep.

"
ChatPDF,1,1,17,pain,AI overwhelmed,WEAK,"ChatPDF turns your PDFs into a conversation. Perfect for research, exams, or work. Fast, simple, and stress-free!"
Holo,1,1,56,pain,AI overwhelmed,WEAK,{{product.brand}}
HUA lei,1,1,31,pain,AI overwhelmed,WEAK,"Explore how structured online English courses with modules in reading, writing, andcommunication can improve language skills."
Simple AI Stock Valuations,1,1,31,pain,AI overwhelmed,WEAK,#stockmarket #investing #stocks #stocksforbeginners #stockvaluations #daytrading #investingforbeginners #investsmart #stockresearch #stockmarketmadeea
Dean Graziosi,1,1,78,pain,AI overwhelmed,WEAK,"🚨 BY POPULAR DEMAND: Doors are open again
When we closed registration last time, people went nuts!

So we're reopening the AI Amplifier Club. And you "
