row_index,platform,app_name,rating,review_date,review_text,audience_segment,content_category,tension_tag,pain_quotes,benefit_quotes,consideration_set,summary
20,google_play,Coursiv,2,2026-04-07 01:33:15,"I liked the content of the app and the way the journey is built through each course. However, I feel it's quite expensive to maintain the full price, especially since we are not using the full AI toolkit. On top of that, they have the audacity to discontinue the certificate after you cancel the subs",busy_knowledge_worker_28_50,abandonment_regret,professional_upskiller,"it's quite expensive to maintain the full price, especially since we are not using the full AI toolkit | they have the audacity to discontinue the certificate after you cancel the subscription, even though you obtained it while you were a subscriber to their services | I find that a bit rude, and it changed my whole perceived experience about the app",I liked the content of the app and the way the journey is built through each course,"[{""product_mentioned"": ""Coursiv"", ""sentiment"": ""complained_about"", ""verbatim_quote"": ""they have the audacity to discontinue the certificate after you cancel the subscription, even though you obtained it while you were a subscriber to their services""}]","A user who valued Coursiv's structured learning journey cancelled due to high cost and perceived low utilization of the AI toolkit, but the primary driver of negative sentiment and churn is the post-cancellation revocation of an earned certificate, signaling a critical trust and retention risk around credential permanence policy."
21,google_play,Coursiv,1,2026-04-15 03:40:18,"They advertise programs at a fixed rate but hidden in the T&Cs they will continue deducting money at a higher rate if you do not unsubscribe, even though it was supposed to be a once-off payment. In some responses here they claim that they make it clear that it is a subscription model at sign up but",unclear,general_feedback,unclear,hidden in the T&Cs they will continue deducting money at a higher rate if you do not unsubscribe | they claim that they make it clear that it is a subscription model at sign up but sadly that is not the case | they keep quiet about that,,"[{""product_mentioned"": ""Coursiv"", ""sentiment"": ""complained_about"", ""verbatim_quote"": ""They advertise programs at a fixed rate but hidden in the T&Cs they will continue deducting money at a higher rate if you do not unsubscribe, even though it was supposed to be a once-off payment.""}]","This 1-star review reveals a critical trust and billing complaint against Coursiv, specifically alleging deceptive pricing practices where a one-time payment was misrepresented and undisclosed recurring charges at a higher rate were applied, with the company reportedly denying the lack of transparency."
22,google_play,Coursiv,1,2026-03-23 07:38:13,"I subscribed to the $9.99 introductory offer for basic AI courses. A few weeks later, I noticed an additional $50 charge from Coursiv and contacted support. They claimed I purchased extra access to ChatGPT and other AI tools. I did NOT subscribe to any such services. I suggested it could be a techni",unclear,abandonment_regret,unclear,"I noticed an additional $50 charge from Coursiv and contacted support | They claimed I purchased extra access to ChatGPT and other AI tools. I did NOT subscribe to any such services. | I have NOT used those additional tools even once. | Despite multiple requests, Coursiv DENIED a full refund. | Be careful!",,"[{""product_mentioned"": ""Coursiv"", ""sentiment"": ""complained_about"", ""verbatim_quote"": ""I subscribed to the $9.99 introductory offer for basic AI courses. A few weeks later, I noticed an additional $50 charge from Coursiv and contacted support. Despite multiple requests, Coursiv DENIED a full refund.""}]","This review reveals a billing dispute and trust breakdown with Coursiv, where a user who signed up for a low-cost introductory AI course was charged an unexpected $50 fee for services they deny purchasing or using, and was refused a refund — signaling a serious retention and credibility risk for the platform around upsell mechanics."
23,google_play,Coursiv,1,2026-03-17 22:47:19,"This service employs deceptive marketing and predatory billing practices. After enrolling in a low-cost trial, I was hit with over $400 in undisclosed fees over a period of 5 months. I only discovered these charges by chance and have since terminated the subscription. Despite having barely used the ",unclear,abandonment_regret,unclear,"This service employs deceptive marketing and predatory billing practices. | After enrolling in a low-cost trial, I was hit with over $400 in undisclosed fees over a period of 5 months. | I only discovered these charges by chance and have since terminated the subscription. | Despite having barely used the platform, my request for a complimentary month to actually value the service was also denied. | This is a clear instance of bait-and-switch pricing and unauthorized subscription billing.",,"[{""product_mentioned"": ""Coursiv"", ""sentiment"": ""complained_about"", ""verbatim_quote"": ""This service employs deceptive marketing and predatory billing practices. After enrolling in a low-cost trial, I was hit with over $400 in undisclosed fees over a period of 5 months.""}]","This 1-star review reveals a critical trust and billing integrity problem with Coursiv — the user reports $400 in undisclosed charges over 5 months following a low-cost trial, ultimately cancelling without meaningfully engaging with the product, signaling that predatory monetization practices are actively destroying retention and brand credibility before users can experience any learning value."
24,google_play,Coursiv,1,2026-02-16 09:54:22,"Coursiv gets you to sign up by promising a learning experience and then as soon as you have signed up, bombards you with ""special"" offers valid ""only for the next 10 minutes. So far it's looking very much like Coursiv is a racket for getting people to buy stuff that they may or may not need. I very ",unclear,abandonment_regret,unclear,"bombards you with ""special"" offers valid ""only for the next 10 minutes"" | So far it's looking very much like Coursiv is a racket for getting people to buy stuff that they may or may not need | Coursiv kept popping up constantly. so I bought it. And so far I am not impressed",,"[{""product_mentioned"": ""Coursiv"", ""sentiment"": ""complained_about"", ""verbatim_quote"": ""Coursiv gets you to sign up by promising a learning experience and then as soon as you have signed up, bombards you with \""special\"" offers valid \""only for the next 10 minutes. So far it's looking very much like Coursiv is a racket for getting people to buy stuff that they may or may not need.""}]","This 1-star review reveals that Coursiv is perceived as a predatory upsell funnel that exploits impulse buyers with aggressive time-limited offers immediately post-signup, resulting in buyer's remorse and zero perceived learning value delivered."
25,google_play,Coursiv,4,2026-02-07 01:19:30,"During an early lesson on image creation using Midjourney, one out of two possible options was not available to me. I was able to replace 'big' with 'towering' but not with 'gigantic'. Very annoying! I suspect a bug in the tutorial software. Perhaps I was not supposed to be allowed to choose 'gigant",unclear,technical_barrier_complaint,unclear,one out of two possible options was not available to me | Very annoying! | it was not made clear,,"[{""product_mentioned"": ""Coursiv"", ""sentiment"": ""complained_about"", ""verbatim_quote"": ""one out of two possible options was not available to me""}, {""product_mentioned"": ""Midjourney"", ""sentiment"": ""neutral"", ""verbatim_quote"": ""an early lesson on image creation using Midjourney""}]","This review signals a UX/bug frustration with Coursiv's interactive tutorial mechanic — a missing answer option during a Midjourney prompt-writing lesson — with no pain or benefit language tied to career anxiety, time constraints, or learning outcomes, leaving audience segment and motivational context unclassifiable."
26,google_play,Coursiv,1,2026-02-26 17:59:52,"Its a Scam, dont use Coursiv I subscribed to basic plan for 19.99 USD. However, I did not continue using the courses as I found the content too basic & repetitive for my needs. yesterday, I was surprised to discover that my subscription had been automatically renewed at 39.99 USD, which is double th",unclear,abandonment_regret,unclear,"I found the content too basic & repetitive for my needs | I was surprised to discover that my subscription had been automatically renewed at 39.99 USD, which is double the original price | I was not clearly aware that the price would increase to the standard rate after the initial price",,"[{""product_mentioned"": ""Coursiv"", ""sentiment"": ""complained_about"", ""verbatim_quote"": ""Its a Scam, dont use Coursiv I subscribed to basic plan for 19.99 USD""}]","This 1-star review reveals a high-priority churn and trust signal for Coursiv: the user abandoned the product due to content perceived as too basic and repetitive, then felt financially deceived by an undisclosed price-doubling auto-renewal from $19.99 to $39.99, explicitly labeling the product a scam — indicating both a content-depth failure and a billing transparency problem that may be driving negative word-of-mouth."
27,google_play,Coursiv,3,2026-03-27 06:55:01,"I've been learning this new AI stuff. I'm not far into it. It seems so simple and easy, but I can't get Alexa to turn up the heat or turn a darn light on. I really want to learn this stuff because I got sick a few years back, and I am tired of fighting for disability. It's exhausting. Yet, its expen",absolute_beginner_curious_explorer,technical_barrier_complaint,unclear,"I can't get Alexa to turn up the heat or turn a darn light on | its expensive to keep paying for courses | I dont have the energy to do them all day either | AI are hard to direct | I got sick a few years back, and I am tired of fighting for disability. It's exhausting.",I really want to learn this stuff,"[{""product_mentioned"": ""Coursiv"", ""sentiment"": ""complained_about"", ""verbatim_quote"": ""I do wish they were more challenging, so I got more out of it""}]","A health-limited beginner finds Coursiv too simplistic and too expensive relative to the value received, while also struggling to grasp basic AI tool interactions, signaling a need for accessible but substantively challenging content designed for low-energy, budget-constrained learners."
28,google_play,Coursiv,1,2026-02-28 06:09:46,"Play Store, scroll down to the ""Flag as inappropriate"" section. email by them Our platform operates on a subscription-based model, which means that all the materials and information are available as long as your subscription is active. Since your subscription has been canceled, you no longer have ac",unclear,abandonment_regret,unclear,,,"[{""product_mentioned"": ""Coursiv"", ""sentiment"": ""complained_about"", ""verbatim_quote"": ""Play Store, scroll down to the \""Flag as inappropriate\"" section. email by them Our platform operates on a subscription-based model, which means that all the materials and information are available as long as your subscription is active. Since your subscription has been canceled, you no longer have access to the materials. However, you can reactivate your subscription at any time to regain access to the content you've completed and continue your learning journey.""}]","This 1-star review consists almost entirely of a pasted copy-paste of Coursiv's own subscription cancellation response email, suggesting the reviewer received an unsatisfactory reply about losing access to paid content after cancellation and is directing other users to flag the app as inappropriate — indicating strong dissatisfaction with the paywall/access model but providing no personal pain language, benefit language, competitor mentions, or demographic signals."
29,google_play,Coursiv,5,2026-04-15 00:38:35,"Coursiv is a helpful app for learning AI basics, especially for beginners. The lessons are simple, clear, and easy to follow. It’s great for quick learning, but the content can feel a bit basic if you already have experience. Also, be mindful of the subscription details. Overall, a good starting poi",absolute_beginner_curious_explorer,course_recommendation,unclear,the content can feel a bit basic if you already have experience | be mindful of the subscription details,"helpful app for learning AI basics, especially for beginners | The lessons are simple, clear, and easy to follow | great for quick learning | a good starting point for AI learning","[{""product_mentioned"": ""Coursiv"", ""sentiment"": ""recommended"", ""verbatim_quote"": ""Coursiv is a helpful app for learning AI basics, especially for beginners""}]",A beginner-oriented reviewer recommends Coursiv as an accessible entry point for AI learning but flags content depth limitations for experienced users and raises a subtle concern about subscription transparency.
30,google_play,Coursiv,1,2026-04-14 07:35:23,I paid for a monthly subscription but cancelled as I only wanted to pay for a month. My subscription was open for another 4 weeks but I was locked out behind a pay wall. emails to support are answered by a bot and go round in circles. summary I paid 30usd for a month and have received no content/tra,unclear,abandonment_regret,unclear,I paid for a monthly subscription but cancelled as I only wanted to pay for a month. | My subscription was open for another 4 weeks but I was locked out behind a pay wall. | emails to support are answered by a bot and go round in circles. | I paid 30usd for a month and have received no content/training so far...,,"[{""product_mentioned"": ""Coursiv"", ""sentiment"": ""complained_about"", ""verbatim_quote"": ""I paid 30usd for a month and have received no content/training so far...""}]","This 1-star review reveals a critical billing and access failure at Coursiv — the user paid $30 for a monthly subscription, was locked out of content immediately after cancelling (despite time remaining), and received no support resolution, resulting in zero learning value delivered and a high-risk churn signal tied to paywall mechanics and bot-driven customer service."
31,google_play,Coursiv,1,2026-04-13 19:53:31,"A complete waste of time. Misleading. The ads specifically say ""no courses, no challenges, just answer the quiz and choose a business."" But that's exactly what Coursiv is: courses and quizzes. No ready to implement business plan. No help choosing a business. And the coursework is lame, best for kind",career_switcher_45_plus,abandonment_regret,side_hustler,"A complete waste of time. Misleading. | No ready to implement business plan. No help choosing a business. | the coursework is lame, best for kindergartners | Like the rest of the Internet, they assume anyone over the age of 50 is senile and can barely handle a keyboard. Insulting.",,"[{""product_mentioned"": ""Coursiv"", ""sentiment"": ""complained_about"", ""verbatim_quote"": ""A complete waste of time. Misleading. The ads specifically say \""no courses, no challenges, just answer the quiz and choose a business.\"" But that's exactly what Coursiv is: courses and quizzes.""}]","A user aged 50+ who sought an actionable, non-condescending business-selection tool feels deceived by Coursiv's ad claims versus its actual course-and-quiz format, revealing a sharp unmet need for age-respectful, implementation-ready entrepreneurship guidance rather than remedial coursework."
32,google_play,Coursiv,4,2026-04-08 22:18:43,"I've only spent 3 days in my first course, so my experience is limited. So far, I find the lesson straightforward and well-organized. There are exercises to do, but they are simplistic and involve choosing from options provided. I would prefer to get more hands on with the software.",absolute_beginner_curious_explorer,general_feedback,unclear,they are simplistic and involve choosing from options provided | I would prefer to get more hands on with the software,I find the lesson straightforward and well-organized,"[{""product_mentioned"": ""Coursiv"", ""sentiment"": ""neutral"", ""verbatim_quote"": ""I've only spent 3 days in my first course, so my experience is limited. So far, I find the lesson straightforward and well-organized.""}]","An early-stage user (3 days in) finds Coursiv's content clear and organized but flags a key product gap: exercises are too passive and multiple-choice-based, with insufficient hands-on practice, suggesting the platform may underwhelm users seeking applied skill-building."
33,google_play,Coursiv,1,2026-04-03 16:54:54,Can't say about their course but Very unethical and bad way of working. I purchased their subscription for ₹1700/- and they asked me for bank mandate of upto ₹4999/- so that subscription don't end. This doesn't mean that the company can debit ₹4999/- for no reason. I paid ₹1700/- for month and ended,unclear,general_feedback,unclear,"Very unethical and bad way of working | This is very very unethical. Shame | I paid ₹1700/- for month and ended my subscription with my will, why you charged me ₹4999/-? | I didn't purchase anything additional nor did I extend my subscription",,"[{""product_mentioned"": ""Coursiv"", ""sentiment"": ""complained_about"", ""verbatim_quote"": ""I purchased their subscription for \u20b91700/- and they asked me for bank mandate of upto \u20b94999/- so that subscription don't end. This doesn't mean that the company can debit \u20b94999/- for no reason.""}]","This 1-star review contains zero commentary on course content or learning outcomes and is exclusively a billing/ethics complaint about Coursiv charging ₹4999 via bank mandate without the user's consent after they cancelled a ₹1700 subscription, flagging a significant trust and retention risk around Coursiv's auto-renewal/mandate practices in the Indian market."
34,google_play,Coursiv,4,2026-03-22 21:11:47,"I’ve found this app really helpful for learning specific AI tools and apps. It walks you through each one from a beginner’s perspective, which makes it easy to follow and actually understand how to use them. The only thing I would suggest improving is including a direct link to each app being taught",absolute_beginner_curious_explorer,course_recommendation,unclear,,"It walks you through each one from a beginner's perspective, which makes it easy to follow and actually understand how to use them.","[{""product_mentioned"": ""Coursiv"", ""sentiment"": ""recommended"", ""verbatim_quote"": ""I've found this app really helpful for learning specific AI tools and apps.""}]","This reviewer values Coursiv's beginner-friendly, step-by-step walkthroughs of AI tools but signals an unmet need for pricing transparency and direct app links, suggesting they are actively evaluating and adopting new AI tools rather than deeply upskilling for career advancement."
35,google_play,Coursiv,5,2026-04-07 08:41:58,"This is a great app to learn from thus far. I subscribed for a month currently and plan on continuing at the full monthly cost maybe after it expires. So far..... Pros: Feels genuine, very interactive with the lessons, simple with the learning process, and gives you options to read the lessons inste",absolute_beginner_curious_explorer,course_recommendation,unclear,,"Feels genuine, very interactive with the lessons, simple with the learning process, and gives you options to read the lessons instead of the dry voices.","[{""product_mentioned"": ""Coursiv"", ""sentiment"": ""recommended"", ""verbatim_quote"": ""This is a great app to learn from thus far. I subscribed for a month currently and plan on continuing at the full monthly cost maybe after it expires.""}]","A generally satisfied early-stage Coursiv subscriber highlights interactivity and simplicity as key differentiators while flagging minor UX bugs around progress tracking and answer grading, suggesting the core learning experience is winning over beginners but product polish needs work."
36,google_play,Coursiv,5,2026-02-23 03:02:32,"If your goal is to have a simple, but useful, background on various AI tools and gain some beginner but broad knowledge level in several AI models, then joining and taking the Coursiv course/challenges will get you real close to that. Should there be any technical issue during the course, I can atte",absolute_beginner_curious_explorer,course_recommendation,professional_upskiller,,"a simple, but useful, background on various AI tools and gain some beginner but broad knowledge level in several AI models | joining and taking the Coursiv course/challenges will get you real close to that | Within a minute of sending an email, the team responded to my complaint and promised a fast resolution. And they delivered -- much to my satisfaction.","[{""product_mentioned"": ""Coursiv"", ""sentiment"": ""recommended"", ""verbatim_quote"": ""joining and taking the Coursiv course/challenges will get you real close to that""}]","A beginner-oriented user praises Coursiv for delivering accessible, broad AI literacy across multiple tools and highlights exceptional customer support responsiveness as a key trust-building differentiator."
37,google_play,Coursiv,4,2026-04-06 22:06:18,"Relevant and easy to resonate examples you i.e weekly Sunday stress for team updates ah. I have been using literally just basics of Ai tools. Material is easy to digest but only bug bear is the costing and was not done in the 12 weeks so Trump's war after the exchange rate lol. However, I genuinely ",busy_knowledge_worker_28_50,course_recommendation,professional_upskiller,I have been using literally just basics of Ai tools. | only bug bear is the costing | was not done in the 12 weeks,Relevant and easy to resonate examples | Material is easy to digest | I genuinely recommend this App and course.,"[{""product_mentioned"": ""Coursiv"", ""sentiment"": ""recommended"", ""verbatim_quote"": ""I genuinely recommend this App and course.""}]","A self-described AI basics user recommends Coursiv for its relatable, digestible content but flags pricing and inability to complete the course within the 12-week window as friction points, suggesting a time-constrained professional audience sensitive to cost and pacing."
38,google_play,Coursiv,1,2026-02-24 14:53:36,Will charge you with extras!! Paid $39.99 for 12 weeks and at the same time they charged me a second time and this time for $49.99 for some add ons I never wanted or agreed to.. Was happy with my purchase and now am very unhappy and out of more money (+$49.99) than what I had originally paid for wha,unclear,general_feedback,unclear,Will charge you with extras!! | they charged me a second time and this time for $49.99 for some add ons I never wanted or agreed to | now am very unhappy and out of more money (+$49.99) than what I had originally paid for what I wanted | ALMOST $100 FOR 12 WEEKS FOR AN APP!,Was happy with my purchase,"[{""product_mentioned"": ""Coursiv"", ""sentiment"": ""complained_about"", ""verbatim_quote"": ""Paid $39.99 for 12 weeks and at the same time they charged me a second time and this time for $49.99 for some add ons I never wanted or agreed to""}]","This 1-star review reveals a billing trust and transparency problem with Coursiv, where a user who was initially satisfied was converted to a detractor after experiencing an unauthorized upsell charge of $49.99 on top of the agreed $39.99 fee, signaling a predatory monetization pattern that could damage brand credibility and deter price-sensitive learners."
39,google_play,Coursiv,5,2026-03-03 06:10:24,"I love how it's broken down into small basic mini lessons, that are clear and easy to understand. I also like how I have the option to read, and or listen, and graphics. everyone learns differently. I also like that it gives me the option of enjoying the feeling of accomplishment after a short simpl",absolute_beginner_curious_explorer,course_recommendation,unclear,,"I love how it's broken down into small basic mini lessons, that are clear and easy to understand. | I also like how I have the option to read, and or listen, and graphics. everyone learns differently. | I also like that it gives me the option of enjoying the feeling of accomplishment after a short simple lesson, or if I feel confident I can work ahead at my own pace!","[{""product_mentioned"": ""Coursiv"", ""sentiment"": ""recommended"", ""verbatim_quote"": ""I love how it's broken down into small basic mini lessons, that are clear and easy to understand.""}]","This 5-star review signals strong product-market fit with learners who value multimodal content delivery, bite-sized lessons, and self-paced progression — likely an absolute beginner who prioritizes accessibility and positive reinforcement over speed or career-specific outcomes."
