row_index,platform,app_name,rating,review_date,review_text,audience_segment,content_category,tension_tag,pain_quotes,benefit_quotes,consideration_set,summary
40,google_play,Coursiv,1,2026-02-05 18:29:46,When signing up there are tons of options to add but even though I thought I did not choose them I was charged for them. It is difficult to apply for refund and when given refund I was only given 50%. Training is not really training it is just cutting and pasting their prompts it is not worth the mo,unclear,abandonment_regret,unclear,there are tons of options to add but even though I thought I did not choose them I was charged for them | It is difficult to apply for refund and when given refund I was only given 50% | Training is not really training it is just cutting and pasting their prompts it is not worth the money | basically a scam for getting charged for the extras,,"[{""product_mentioned"": ""Coursiv"", ""sentiment"": ""complained_about"", ""verbatim_quote"": ""basically a scam for getting charged for the extras. Stay clear of this app.""}]","This 1-star review reveals that Coursiv faces serious trust and value perception problems, with the user feeling deceived by hidden upsell charges, denied a full refund, and left with content they perceived as low-effort prompt copy-pasting rather than genuine AI training — a strong signal of product-market fit failure on both pricing transparency and content depth."
41,google_play,Coursiv,5,2026-04-10 06:46:24,when I first started learning AI I thought it was just a few lessons but as I go on and there are so many different types of ai and many platforms that do different things that I was not aware of it makes me want to keep learning more! I love it.,absolute_beginner_curious_explorer,success_story,unclear,there are so many different types of ai and many platforms that do different things that I was not aware of,it makes me want to keep learning more! I love it.,"[{""product_mentioned"": ""Coursiv"", ""sentiment"": ""recommended"", ""verbatim_quote"": ""when I first started learning AI I thought it was just a few lessons but as I go on and there are so many different types of ai and many platforms that do different things that I was not aware of it makes me want to keep learning more! I love it.""}]","A self-identified beginner was surprised by the breadth of AI types and platforms uncovered through Coursiv, with that discovery fueling continued engagement rather than overwhelm, signaling that structured exposure to AI's scope can convert curiosity into sustained motivation."
42,google_play,Coursiv,1,2026-03-29 17:35:47,"so there was some fine print that will cause them to charge you twice to use their tools. I contacted them, said it was a mistake, I didn't mean to purchase the lifetime. They said okay, canceled my lifetime subscription but kept my money. they knew",unclear,abandonment_regret,unclear,there was some fine print that will cause them to charge you twice to use their tools | canceled my lifetime subscription but kept my money. they knew,,"[{""product_mentioned"": ""Coursiv"", ""sentiment"": ""complained_about"", ""verbatim_quote"": ""there was some fine print that will cause them to charge you twice to use their tools. I contacted them, said it was a mistake, I didn't mean to purchase the lifetime. They said okay, canceled my lifetime subscription but kept my money. they knew""}]","This 1-star review signals a serious billing and trust issue with Coursiv, where a user alleges deceptive fine print led to an unintended double charge and a refund was denied despite a cancellation being acknowledged, representing a reputational and retention risk rather than a product-experience or learning-outcome signal."
43,google_play,Coursiv,1,2026-02-07 22:40:12,Total scam. They hide the pricing model and then put you on auto billing without telling you. And then refuse to offer a refund even a single day after the charge hits. Nevermind you haven't used it and won't use it. - The response provided is factually incorrect and misleading. Hence my review stat,unclear,general_feedback,unclear,"Total scam. They hide the pricing model and then put you on auto billing without telling you. | refuse to offer a refund even a single day after the charge hits. Nevermind you haven't used it and won't use it. | terms are not clear and the ""refund policy"" is no refunds under any circumstances. | The response provided is factually incorrect and misleading.",,"[{""product_mentioned"": ""Coursiv"", ""sentiment"": ""complained_about"", ""verbatim_quote"": ""Total scam. They hide the pricing model and then put you on auto billing without telling you. And then refuse to offer a refund even a single day after the charge hits.""}]","This 1-star review signals a critical trust and billing transparency failure with Coursiv — the user never engaged with the learning content and was driven entirely to abandon the product due to opaque auto-billing practices and a non-existent refund policy, with no pain or benefit language related to AI learning goals present in the text."
44,google_play,Coursiv,5,2026-04-06 14:37:13,"Way more VALUABLE than I initially gave it credit for. And super easy to learn from. I highly recommend it to anyone wanting to learn about the full scope of AI's abilities, and how to properly understand and command AI, to ensure the best desired customized results you're looking for.",unclear,course_recommendation,professional_upskiller,,"Way more VALUABLE than I initially gave it credit for. | super easy to learn from | learn about the full scope of AI's abilities | how to properly understand and command AI, to ensure the best desired customized results you're looking for","[{""product_mentioned"": ""Coursiv"", ""sentiment"": ""recommended"", ""verbatim_quote"": ""Way more VALUABLE than I initially gave it credit for. And super easy to learn from. I highly recommend it to anyone wanting to learn about the full scope of AI's abilities, and how to properly understand and command AI, to ensure the best desired customized results you're looking for.""}]","A converted skeptic gives Coursiv a strong endorsement for accessibility and comprehensive AI instruction, signaling that initial low expectations were overcome by ease of use and breadth of content, but no pain language or audience identifiers are present to confirm a specific segment."
45,google_play,Coursiv,1,2026-03-23 07:17:48,"I would like to share my experience with the platform. The main issue I faced was related to pricing transparency. the course it self and the buying the full ai tool in between From a user perspective, it would be much better if users are allowed to complete the course first, and then be offered the",absolute_beginner_curious_explorer,general_feedback,unclear,Being charged upfront for something I am not familiar with and do not yet know how to use is confusing and not user-friendly,,"[{""product_mentioned"": ""Coursiv"", ""sentiment"": ""complained_about"", ""verbatim_quote"": ""the course it self and the buying the full ai tool in between""}]",This 1-star review reveals that Coursiv's upsell model — charging users for an embedded AI tool mid-course before they have context to evaluate it — creates friction and distrust for beginners who need to experience value before committing additional spend.
46,google_play,Coursiv,1,2026-04-08 04:17:19,Beware! it's a rip off and they will charge you three separate amounts on your first day. then I canceled and got charged for another month! I've contacted the company and they never responded! I lost over $200 and never got past the first screen! All I wanted to do was cancel it after I saw what th,unclear,abandonment_regret,unclear,it's a rip off and they will charge you three separate amounts on your first day | then I canceled and got charged for another month! | I've contacted the company and they never responded! | I lost over $200 and never got past the first screen! | All I wanted to do was cancel it after I saw what they charged!,,"[{""product_mentioned"": ""Coursiv"", ""sentiment"": ""complained_about"", ""verbatim_quote"": ""it's a rip off and they will charge you three separate amounts on your first day. then I canceled and got charged for another month! I've contacted the company and they never responded! I lost over $200 and never got past the first screen!""}]","This review reveals a critical billing and trust failure with Coursiv — the user was multiply charged on day one, charged again after cancellation, received no customer support response, and never accessed any product content, signaling a severe onboarding and billing integrity problem that poses a direct churn and reputation risk."
47,google_play,Coursiv,1,2026-03-20 02:41:58,"The app itself is decent, but the material they provide can easily be found for free on YouTube and other online resources. Because of that, I don’t personally see the value in paying $40 per month. I was charged for 6 months, and when I contacted support about my concerns, I received a very generic",unclear,abandonment_regret,unclear,"I was charged for 6 months, and when I contacted support about my concerns, I received a very generic response that didn't really address the issue. | Customer support felt automated rather than helpful. | if you don't manually cancel your subscription,",,"[{""product_mentioned"": ""Coursiv"", ""sentiment"": ""complained_about"", ""verbatim_quote"": ""The app itself is decent, but the material they provide can easily be found for free on YouTube and other online resources.""}, {""product_mentioned"": ""YouTube"", ""sentiment"": ""compared"", ""verbatim_quote"": ""the material they provide can easily be found for free on YouTube and other online resources""}]","This review signals a value-perception and billing trust problem for Coursiv — the user found the content replicable for free on YouTube, felt overcharged across six months, and received unhelpful automated support, suggesting Coursiv risks churn among cost-conscious users who cannot justify the $40/month subscription without clear differentiated value."
48,google_play,Coursiv,1,2026-04-04 23:45:38,it's a fraud. They give a trial period with a paid subscription which is not worth and then they auto deduct the money after the trial period. None of the customer will even thing to be charged so high for a trial subscription if they dnt go through the terms and conditions which they will be giving,unclear,general_feedback,unclear,it's a fraud. They give a trial period with a paid subscription which is not worth and then they auto deduct the money after the trial period. | None of the customer will even thing to be charged so high for a trial subscription if they dnt go through the terms and conditions which they will be giving inbetween huge description. | it's completely fraud as they too knows that noone will even imagine of auto subscription till the use realized tht every month there is a deducted amount.,,"[{""product_mentioned"": ""Coursiv"", ""sentiment"": ""complained_about"", ""verbatim_quote"": ""it's a fraud. They give a trial period with a paid subscription which is not worth and then they auto deduct the money after the trial period.""}]","This 1-star review focuses exclusively on Coursiv's alleged deceptive billing practices — hidden auto-renewal charges buried in fine print after a paid trial — with no mention of learning outcomes, content quality, or competitor platforms, making it a strong trust and churn signal but yielding no audience segment, benefit language, or competitive consideration set data."
49,google_play,Coursiv,1,2026-02-21 03:18:06,"I have subscribed for the 3 weeks course, paid and received an email that payment is successful and I am all set to begin then I tried to access the content from the app AND the webpage but everytime I open any of them I am forced to subscribe again, which is a huge scam. I am very surprised, after ",unclear,abandonment_regret,unclear,"everytime I open any of them I am forced to subscribe again, which is a huge scam | my experience is very negative | they asked me to change the password! Looks like a SCAM",,"[{""product_mentioned"": ""Coursiv"", ""sentiment"": ""complained_about"", ""verbatim_quote"": ""everytime I open any of them I am forced to subscribe again, which is a huge scam""}]","This 1-star review signals a critical trust and access failure — the user paid for Coursiv, received confirmation, but was locked out of content and received unhelpful support, leading them to publicly label the product a scam; no competitor products, pain keywords from seed vocabulary, or benefit language were present, making competitive and segmentation signals minimal beyond a strong warning flag on Coursiv's onboarding and billing infrastructure."
50,google_play,Coursiv,1,2026-02-06 00:01:34,was charged for a renewal that was not approved. they set the renewal to automatic and charge you again. when i confronted them about it i got the line of bs saying its in the contract. unless your paying attention youll get ripped off by them. the charge hasnt even cleared and i have not used the a,unclear,abandonment_regret,unclear,was charged for a renewal that was not approved | they set the renewal to automatic and charge you again | unless your paying attention youll get ripped off by them | the charge hasnt even cleared and i have not used the app in weeks | they are not interested in returning my money | basically a trap kind of business | their courses are a complete joke,you can learn more just asking your computers ai how to do any task,"[{""product_mentioned"": ""Coursiv"", ""sentiment"": ""complained_about"", ""verbatim_quote"": ""basically a trap kind of business. their courses are a complete joke.""}, {""product_mentioned"": ""your computers ai"", ""sentiment"": ""compared"", ""verbatim_quote"": ""you can learn more just asking your computers ai how to do any task""}]","This 1-star review of Coursiv (highest-priority product match confirmed) signals a billing trust crisis — the user was auto-renewed without perceived consent, has not used the app in weeks suggesting low engagement or product abandonment, explicitly dismisses the course quality as inferior to free AI tools, and represents a strong churn-and-warn signal with zero detected seed pain vocabulary around AI learning anxiety, indicating the review is driven by billing grievance rather than a learning need."
51,google_play,Coursiv,1,2026-02-27 07:27:38,"I thought I would give it a shot. I thought the tutorial was very simple and elementary, but on top of that the presentation was boring and frustrating. Then less than 30 days after I paid them for their introductory course, they hit my account for $39.99. It is a total scam. The information is week",absolute_beginner_curious_explorer,abandonment_regret,unclear,"the presentation was boring and frustrating | less than 30 days after I paid them for their introductory course, they hit my account for $39.99 | they are just tricking people into signing up so they can suck money out of their clients accounts",,"[{""product_mentioned"": ""Coursiv"", ""sentiment"": ""complained_about"", ""verbatim_quote"": ""It is a total scam. The information is week and they are just tricking people into signing up so they can suck money out of their clients accounts.""}, {""product_mentioned"": ""Youtube"", ""sentiment"": ""recommended"", ""verbatim_quote"": ""There are real resources available on Youtube that cost nothing""}]","This 1-star review reveals a user who felt deceived by Coursiv's hidden subscription billing, found the content overly simplistic and dull, and ultimately dismissed the platform as a scam in favor of free YouTube resources, signaling a trust and value-for-money breakdown rather than a skills or time-constraint issue."
52,google_play,Coursiv,3,2026-03-02 04:38:12,just started but so far loving it plus I know how to use ai better than I did before- Update- I got through a few courses and even paid for the monthly subscriptions and was gonna pay the extra's as well but when I tried it wouldn't allow me to use it so I would recommend you not to use the app ther,absolute_beginner_curious_explorer,abandonment_regret,unclear,when I tried it wouldn't allow me to use it so I would recommend you not to use the app there was only problems when you got passed the free trial,just started but so far loving it plus I know how to use ai better than I did before,"[{""product_mentioned"": ""Coursiv"", ""sentiment"": ""complained_about"", ""verbatim_quote"": ""when I tried it wouldn't allow me to use it so I would recommend you not to use the app there was only problems when you got passed the free trial so to avoid don't get""}]","A user who initially saw genuine AI learning value in Coursiv abandoned the platform after hitting a hard paywall or technical access failure post-subscription, converting early enthusiasm into a public warning against purchase — signaling a critical onboarding-to-paid conversion breakdown that risks brand damage among beginner users."
53,google_play,Coursiv,1,2026-02-20 05:16:22,was way too basic and not relevant to anything i was interested in learning nor could i personalize the training. But worst of all they charged multiple charges on my card and said i chose those upgrades when I thought i only paid for the basic subscription to try it out but it made me click on acce,unclear,abandonment_regret,unclear,was way too basic and not relevant to anything i was interested in learning | nor could i personalize the training | they charged multiple charges on my card and said i chose those upgrades when I thought i only paid for the basic subscription to try it out | it made me click on accepting other charges of which i thought were included just so i could move forward and check out | they wouldn't refund me any of those funds and didn't care and weren't helpful at all,,"[{""product_mentioned"": ""Coursiv"", ""sentiment"": ""complained_about"", ""verbatim_quote"": ""was way too basic and not relevant to anything i was interested in learning nor could i personalize the training. But worst of all they charged multiple charges on my card and said i chose those upgrades when I thought i only paid for the basic subscription to try it out but it made me click on accepting other charges of which i thought were included just so i could move forward and check out. they wouldn't refund me any of those funds and didn't care and weren't helpful at all""}]","This 1-star review reveals a dual failure: the product was perceived as too generic and non-personalizable for the user's learning goals, compounded by a deceptive dark-pattern upsell flow at checkout and an unresponsive refund process, signaling serious trust and retention risks for Coursiv among cautious trial-intent users."
54,google_play,Coursiv,1,2026-02-02 15:24:53,"I’m very disappointed with this app. The so-called personalised learning plan was useless because several of the featured AIs aren’t even available in my region. On top of that, trainings for three very similar image creation AIs were offered, which I felt completely redundant. When I asked for a re",unclear,abandonment_regret,unclear,"The so-called personalised learning plan was useless because several of the featured AIs aren't even available in my region | trainings for three very similar image creation AIs were offered, which I felt completely redundant | When I asked for a refund, my request was refused, and the only ""solution"" they provided was stopping the auto-renewal of my subscription | Felt like being scammed by false advertising and poor service",,"[{""product_mentioned"": ""Coursiv"", ""sentiment"": ""complained_about"", ""verbatim_quote"": ""The so-called personalised learning plan was useless because several of the featured AIs aren't even available in my region""}]","This 1-star review reveals that Coursiv's core value proposition — personalized AI learning plans — is critically undermined by geo-availability gaps and content redundancy, compounded by a refund refusal that converted a disappointed user into an actively hostile one reporting scam-like service."
55,google_play,Coursiv,4,2026-01-24 08:44:40,"I like the lessons, but when you don't get an answer right, it would be nice if they highlighted the correct answer instead of just telling you you're incorrect and then giving some vague semblance of what seems to be similar to one of the other answers but not definitively so. it's easier to learn ",unclear,general_feedback,unclear,"when you don't get an answer right, it would be nice if they highlighted the correct answer instead of just telling you you're incorrect and then giving some vague semblance of what seems to be similar to one of the other answers but not definitively so | it's easier to learn from your mistakes if you know exactly what the right answer is",I like the lessons,"[{""product_mentioned"": ""Coursiv"", ""sentiment"": ""complained_about"", ""verbatim_quote"": ""I like the lessons, but when you don't get an answer right, it would be nice if they highlighted the correct answer instead of just telling you you're incorrect and then giving some vague semblance of what seems to be similar to one of the other answers but not definitively so""}]","This 4-star review signals that Coursiv's quiz feedback UX is a friction point — users are retained and engaged with the lessons but frustrated by ambiguous wrong-answer feedback, pointing to a product gap in reinforcement learning design that could affect completion rates."
56,google_play,Coursiv,5,2026-03-07 18:06:26,This teaching tool is very helpful in understanding basic creative building for all kinds of needs. I have learn a lot in a short period of time without stress or classroom pressure. I have only completed one full course on Dall-E but I understand more than I ever did before. Teaching how to prompt ,absolute_beginner_curious_explorer,success_story,unclear,Teaching how to prompt is now as hard as I thought it would be. | I have only completed one full course on Dall-E but I understand more than I ever did before.,I have learn a lot in a short period of time without stress or classroom pressure. | This teaching tool is very helpful in understanding basic creative building for all kinds of needs. | This is great for anyone wanting to learn from the beginning.,"[{""product_mentioned"": ""Coursiv"", ""sentiment"": ""recommended"", ""verbatim_quote"": ""This teaching tool is very helpful in understanding basic creative building for all kinds of needs.""}, {""product_mentioned"": ""Dall-E"", ""sentiment"": ""neutral"", ""verbatim_quote"": ""I have only completed one full course on Dall-E but I understand more than I ever did before.""}]","An absolute beginner found Coursiv accessible and low-pressure for learning AI prompting from scratch, completing a Dall-E course and gaining confidence without prior technical knowledge."
57,google_play,Coursiv,5,2026-02-22 09:57:53,"Pretty useful at educating users on how to use most if not all the AI tools currently available out there. Each AI has its purpose and ways of helping you they're not all the same, some came make pictures from the descriptions you give it, and also make business images for any presentations you may ",absolute_beginner_curious_explorer,course_recommendation,professional_upskiller,I haven't explored it fully,"Pretty useful at educating users on how to use most if not all the AI tools currently available out there | Each AI has its purpose and ways of helping you they're not all the same | some came make pictures from the descriptions you give it, and also make business images for any presentations you may have","[{""product_mentioned"": ""Coursiv"", ""sentiment"": ""recommended"", ""verbatim_quote"": ""good job Coursiv \ud83d\udc4d\ud83c\udffe""}]","An early-stage user praises Coursiv for demystifying the AI tool landscape and differentiating use cases across tools, but signals incomplete product exploration, suggesting high initial perceived value with retention risk if depth is not discovered."
58,google_play,Coursiv,5,2026-02-18 01:06:56,"I'm almost finished the 2nd app course. I read a lot of reviews before startng this course saying it's not worth the $19.99 28 day outlay. Here's what I can say, i learnt something new that I didn't already know from the first 15 minute lesson. I kept learning with each lesson thereafter. I admit I'",absolute_beginner_curious_explorer,success_story,professional_upskiller,I read a lot of reviews before startng this course saying it's not worth the $19.99 28 day outlay | I admit I'm a novice which seems to be the target audience | I no longer fear being left off the progress train,i learnt something new that I didn't already know from the first 15 minute lesson | I kept learning with each lesson thereafter | I no longer fear being left off the progress train | best $20 I've spent in ages,"[{""product_mentioned"": ""Coursiv"", ""sentiment"": ""recommended"", ""verbatim_quote"": ""I'm almost finished the 2nd app course. I read a lot of reviews before startng this course saying it's not worth the $19.99 28 day outlay.""}]","A self-identified novice overcame skepticism from negative reviews and found genuine incremental learning value in Coursiv's bite-sized lessons, with the key emotional payoff being relief from fear of falling behind on AI progress."
