row_index,platform,app_name,rating,review_date,review_text,audience_segment,content_category,tension_tag,pain_quotes,benefit_quotes,consideration_set,summary
59,google_play,Coursiv,3,2026-02-18 19:29:14,"I’m giving this course 3 stars, and that’s being generous. The content is informative, but it fails in one key area, it doesn’t include access to the actual AI platform you’re being trained to use. After paying for the course, you’re then told to purchase the AI program separately, even if it’s at a",unclear,general_feedback,professional_upskiller,"After paying for the course, you're then told to purchase the AI program separately, even if it's at a ""discount."" | If I'm investing in training to learn a specific tool, I should be able to actively use it during the course itself. | Requiring an additional purchase undermines the overall value.",,"[{""product_mentioned"": ""Coursiv"", ""sentiment"": ""complained_about"", ""verbatim_quote"": ""I'm giving this course 3 stars, and that's being generous. The content is informative, but it fails in one key area, it doesn't include access to the actual AI platform you're being trained to use.""}]","This review signals a value-perception breakdown where the reviewer feels misled by a hidden upsell model — paying for a course that does not include access to the core tool being taught — suggesting that bundled, hands-on access to AI platforms is a strong purchase criterion for this audience."
60,google_play,Coursiv,5,2026-02-08 05:18:36,"this is a very useful app that teaches all the skills you'll need in this quickly excelling world. t teaches you step by step and has prompts to help you gain the tools and instructions to correctly get the most out of AI tools, plus it makes a daily plan depending on your level of knowledge so you ",absolute_beginner_curious_explorer,course_recommendation,professional_upskiller,,teaches all the skills you'll need in this quickly excelling world | teaches you step by step and has prompts to help you gain the tools and instructions to correctly get the most out of AI tools | makes a daily plan depending on your level of knowledge so you can obtain and complete the whole course it designated amount of time | you can add the qualification of knowing AI tools to job,"[{""product_mentioned"": ""Coursiv"", ""sentiment"": ""recommended"", ""verbatim_quote"": ""I definitely recommend taking this course. it's well worth the money.""}]","A beginner-leaning user praises Coursiv's structured, step-by-step format and personalized daily learning plans as key differentiators that make AI skills accessible and credentializable for job purposes, with no competitors mentioned and no explicit pain language surfaced."
61,google_play,Coursiv,5,2026-02-04 09:49:15,"The course is very easy to understand and not too long. It explains well what to know about each AI Tools their meaning, functions and how you can fully use it for everyday life. I will continue to learn everyday, so that I can use them soon to help me further in different things I do in life. I am ",absolute_beginner_curious_explorer,course_recommendation,unclear,,"It explains well what to know about each AI Tools their meaning, functions and how you can fully use it for everyday life. | I will continue to learn everyday, so that I can use them soon to help me further in different things I do in life. | I am just starting and I like what I've learned so far.","[{""product_mentioned"": ""Coursiv"", ""sentiment"": ""recommended"", ""verbatim_quote"": ""The course is very easy to understand and not too long. It explains well what to know about each AI Tools their meaning, functions and how you can fully use it for everyday life.""}]","A self-identified beginner praises Coursiv for its accessibility and digestible format, signaling strong product-market fit with non-technical users seeking a gentle, practical introduction to AI tools for everyday life use."
62,google_play,Coursiv,3,2026-02-08 23:26:00,"for someone who is eager to learn about a broad variety of skills and how they can be utilized, gather some awareness of their own strengths/interests, and to dip their toes in the water, this course is great. if you want advanced knowledge, then go out and get that too. I hear a lot of criticism of",absolute_beginner_curious_explorer,course_recommendation,professional_upskiller,,it helped my prompting and understanding of what different AI programs do | gather some awareness of their own strengths/interests | dip their toes in the water,"[{""product_mentioned"": ""this course"", ""sentiment"": ""recommended"", ""verbatim_quote"": ""for what I paid, it helped my prompting and understanding of what different AI programs do""}]","A value-conscious beginner defends Coursiv against criticism, positioning it as a solid entry-level awareness tool for prompting and AI literacy rather than advanced skill-building, signaling a clear product-market fit for exploratory, non-technical newcomers."
63,google_play,Coursiv,4,2026-04-03 22:52:05,"Coursiv is easy to use. The courses are structured well, with clear explanations. I like the interactive questions and tasks dotted throughout each course. I'm learning a lot - day-to-day.",unclear,course_recommendation,professional_upskiller,,"I'm learning a lot - day-to-day. | The courses are structured well, with clear explanations. | I like the interactive questions and tasks dotted throughout each course.","[{""product_mentioned"": ""Coursiv"", ""sentiment"": ""recommended"", ""verbatim_quote"": ""Coursiv is easy to use. The courses are structured well, with clear explanations. I like the interactive questions and tasks dotted throughout each course. I'm learning a lot - day-to-day.""}]","This brief, positive review highlights Coursiv's ease of use, structured content, and interactive format as key satisfiers, but contains no pain language, competitor mentions, or demographic signals to further qualify the user's segment or unmet needs."
64,google_play,Coursiv,1,2026-02-15 00:43:23,"very disapointed I thought I was signing up for the promo price, something was confusing my credit card was billed for 95.64 and also for 31dollars and I do not know why the extracharges when I was only expecting 45 dollars. I will be calling them first thing at the start of the week. this feels lik",unclear,general_feedback,unclear,something was confusing my credit card was billed for 95.64 and also for 31dollars and I do not know why the extracharges when I was only expecting 45 dollars | this feels like a complet bait and switch | I will not be reccomending this to any one,,"[{""product_mentioned"": ""Coursiv"", ""sentiment"": ""complained_about"", ""verbatim_quote"": ""this feels like a complet bait and switch . I will not be reccomending this to any one.""}]","This 1-star review reveals a critical billing trust issue with Coursiv, where a user was charged $126.64 total ($95.64 + $31) against an expected $45 promotional price, triggering a bait-and-switch accusation and strong negative word-of-mouth intent — no pain language around AI learning, career anxiety, or time constraints was present, making audience segmentation and benefit extraction impossible from this text alone."
65,google_play,Coursiv,1,2025-11-09 02:04:19,"I am very disappointed, not because of the app, it is because of the way they sell additional services with confusing advertising and policies that are not allignet with customer orientation. the question is, i get an email with an additional charge for something I didn't request. Immediately, I wro",unclear,general_feedback,unclear,"i get an email with an additional charge for something I didn't request | their answer is because of their policy, No reimbursement can be done | confusing advertising and policies that are not allignet with customer orientation",,"[{""product_mentioned"": ""Coursiv"", ""sentiment"": ""complained_about"", ""verbatim_quote"": ""I am very disappointed, not because of the app, it is because of the way they sell additional services with confusing advertising and policies that are not allignet with customer orientation""}]","This 1-star review reveals a billing and refund dispute with Coursiv — the user was charged for an unrequested service and denied reimbursement, signaling a trust and transparency problem in the platform's subscription and upsell practices rather than any issue with the learning content itself."
66,google_play,Coursiv,1,2025-12-01 11:09:00,I subscribed and paid the initial amount of $ 49 +. Didn't get to open the app but found out that they were debiting my card with a monthly $39.80. I discovered this after a few months and they only refunded one month of subscription. Didn't receive any invoice or notification of the monthly debit. ,unclear,abandonment_regret,unclear,they were debiting my card with a monthly $39.80 | I discovered this after a few months and they only refunded one month of subscription | Didn't receive any invoice or notification of the monthly debit | My laxity was not reconciling my card statement (which happens to a lot of people) | I asked for a refund of the monthly debits but they refused and gave back the last debit | Didn't get to open the app,,"[{""product_mentioned"": ""Coursiv"", ""sentiment"": ""complained_about"", ""verbatim_quote"": ""I subscribed and paid the initial amount of $ 49 +. Didn't get to open the app but found out that they were debiting my card with a monthly $39.80. I discovered this after a few months and they only refunded one month of subscription.""}]","This 1-star review reveals a serious billing and trust complaint against Coursiv, where the user was charged recurring monthly fees of $39.80 without notification or invoicing after an initial $49+ purchase, never accessed the product, and was denied a full refund — signaling a predatory subscription pattern that could represent a significant reputational and churn risk for the platform."
67,google_play,Coursiv,1,2025-12-30 20:16:23,"First, they offer a promotional price and then charge the customer's credit card more than they actually do! Based on the content, which is basic information we all know, I had to request a refund because they took extra money from my credit card and only refunded 50% so I could explore the app furt",unclear,abandonment_regret,unclear,"they offer a promotional price and then charge the customer's credit card more than they actually do | the content, which is basic information we all know | only refunded 50% so I could explore the app further | I don't see much else to it | There are better and cheaper options that deliver on the promotional price",,"[{""product_mentioned"": ""Coursiv"", ""sentiment"": ""complained_about"", ""verbatim_quote"": ""they offer a promotional price and then charge the customer's credit card more than they actually do""}, {""product_mentioned"": ""better and cheaper options"", ""sentiment"": ""compared"", ""verbatim_quote"": ""There are better and cheaper options that deliver on the promotional price""}]","This 1-star review reveals a billing trust violation as the primary churn driver — the user complains Coursiv charged more than the advertised promotional price, issued only a 50% refund, and found the content too basic to justify staying, signaling that pricing integrity and content depth are critical retention risks for this product."
68,google_play,Coursiv,5,2026-03-25 20:33:07,"Amazing is all l can say. Learning made easy! l have learnt a lot in a short while without stress. l wish l had registered with Coursiv long before now. Anyway, l am enjoying every bit of the programme, l would recommend Coursiv to anyone who wants to master AI within a short time.",absolute_beginner_curious_explorer,course_recommendation,professional_upskiller,l wish l had registered with Coursiv long before now,Learning made easy! | l have learnt a lot in a short while without stress | l am enjoying every bit of the programme | anyone who wants to master AI within a short time,"[{""product_mentioned"": ""Coursiv"", ""sentiment"": ""recommended"", ""verbatim_quote"": ""l would recommend Coursiv to anyone who wants to master AI within a short time""}]","A satisfied Coursiv user highlights rapid, stress-free AI learning as the core value proposition and expresses regret at not having discovered the platform sooner, signaling strong word-of-mouth potential among beginners seeking accessible AI mastery."
69,google_play,Coursiv,5,2026-04-01 08:57:22,Im feeling a lot more at ease and confident using these tools. Im starting to really like it. love the short sessions which keeps me wanting to keep going. little bit at a time for us old timers ⏲️ 😄,career_switcher_45_plus,success_story,professional_upskiller,,Im feeling a lot more at ease and confident using these tools | love the short sessions which keeps me wanting to keep going | little bit at a time for us old timers,"[{""product_mentioned"": ""Coursiv"", ""sentiment"": ""recommended"", ""verbatim_quote"": ""Im starting to really like it""}]","An older adult learner ('old timers') signals that Coursiv's short-session format reduces overwhelm and sustains engagement, pointing to a strong product-market fit for time-constrained, non-technical users who need incremental pacing to build confidence with AI tools."
70,google_play,Coursiv,5,2026-04-11 20:58:00,"Course was clear, engaging, and relatable written is layman's terms so as to not over complicate the lessons with industry jargon. Short enough to not be scary to start, but long enough to build the lesson in small achievable chunks.",absolute_beginner_curious_explorer,course_recommendation,professional_upskiller,not over complicate the lessons with industry jargon | Short enough to not be scary to start,"clear, engaging, and relatable written is layman's terms | build the lesson in small achievable chunks","[{""product_mentioned"": ""Coursiv"", ""sentiment"": ""recommended"", ""verbatim_quote"": ""Course was clear, engaging, and relatable written is layman's terms so as to not over complicate the lessons with industry jargon. Short enough to not be scary to start, but long enough to build the lesson in small achievable chunks.""}]","This 5-star review signals strong product-market fit with non-technical beginners who are intimidated by jargon and complexity, praising Coursiv for its accessible language and digestible lesson structure."
71,google_play,Coursiv,5,2026-03-28 01:46:16,"Just started the course on the app, interesting, informing, and user friendly. Lucky for me that I am more than familiar with programming, some holes in presentation or maybe I'm just older than most users today.",career_switcher_45_plus,course_recommendation,professional_upskiller,some holes in presentation or maybe I'm just older than most users today,"interesting, informing, and user friendly","[{""product_mentioned"": ""Coursiv"", ""sentiment"": ""recommended"", ""verbatim_quote"": ""Just started the course on the app, interesting, informing, and user friendly.""}]","A technically experienced, self-described older user gives Coursiv a positive early impression but hints at presentation gaps that may reflect a design skew toward younger or less experienced audiences, suggesting a potential UX alignment gap for senior professionals."
72,google_play,Coursiv,1,2026-02-08 23:58:26,Inaccurate and 100% AI. The course content in this app was not checked by a human. AI made it all up which also means a lot of it is not actually true. What the courses teach you are not actually how the apps and programs they are training you on work. I am extremely disappointed.,unclear,general_feedback,unclear,The course content in this app was not checked by a human. | AI made it all up which also means a lot of it is not actually true. | What the courses teach you are not actually how the apps and programs they are training you on work. | I am extremely disappointed.,,"[{""product_mentioned"": ""Coursiv"", ""sentiment"": ""complained_about"", ""verbatim_quote"": ""The course content in this app was not checked by a human. AI made it all up which also means a lot of it is not actually true.""}]","This 1-star review signals a critical trust and accuracy failure for Coursiv, with the reviewer explicitly identifying unverified, hallucinated AI-generated course content as the core complaint, raising a red flag around content credibility that could deter prospective learners seeking reliable upskilling."
73,google_play,Coursiv,5,2025-12-18 14:15:12,"Coursiv is a great way to introduce you to the expanding world of AI. If you have had little to no experience writing prompts to get ChatGPT and other AI tools, then this is for you. If you have some experience writing code, or have been using computers for a long time, you will still get a lot from",absolute_beginner_curious_explorer,course_recommendation,professional_upskiller,little to no experience writing prompts to get ChatGPT and other AI tools,"Coursiv is a great way to introduce you to the expanding world of AI | you will still get a lot from Coursiv | Overall, I am happy that I bought Coursiv and are looking forward to what comes next","[{""product_mentioned"": ""Coursiv"", ""sentiment"": ""recommended"", ""verbatim_quote"": ""Coursiv is a great way to introduce you to the expanding world of AI""}, {""product_mentioned"": ""ChatGPT"", ""sentiment"": ""neutral"", ""verbatim_quote"": ""little to no experience writing prompts to get ChatGPT and other AI tools""}]","A satisfied beginner-to-intermediate user recommends Coursiv as an accessible AI and prompt-writing entry point, noting it may feel easy for more experienced or logical thinkers, signaling strong product-market fit for non-technical newcomers to AI tools."
74,google_play,Coursiv,5,2026-02-11 02:24:10,"Really breaks it all down. Lessons & examples are interactive enough to trigger memory for great retention of information. Modules seem to be the perfect length, which cuts boredom. I recommend Coursiv to anyone who needs to understand AI in order to take full advantage of all AI has to offer.",absolute_beginner_curious_explorer,course_recommendation,professional_upskiller,,"Really breaks it all down. | Lessons & examples are interactive enough to trigger memory for great retention of information. | Modules seem to be the perfect length, which cuts boredom. | I recommend Coursiv to anyone who needs to understand AI in order to take full advantage of all AI has to offer.","[{""product_mentioned"": ""Coursiv"", ""sentiment"": ""recommended"", ""verbatim_quote"": ""I recommend Coursiv to anyone who needs to understand AI in order to take full advantage of all AI has to offer.""}]","A satisfied 5-star reviewer highlights Coursiv's interactive lessons, digestible module length, and strong knowledge retention as key differentiators, recommending it broadly to anyone seeking to understand and leverage AI — suggesting the platform resonates with beginners who need structured, engaging entry points into AI learning."
75,google_play,Coursiv,4,2026-03-27 01:36:36,"Great intro to AI. Sometimes wish it would go a little deeper or frame the use case better, but great for 1st time intro to get a feel for capabilities and limitations of various AI tools.",absolute_beginner_curious_explorer,course_recommendation,professional_upskiller,Sometimes wish it would go a little deeper or frame the use case better,great for 1st time intro to get a feel for capabilities and limitations of various AI tools,"[{""product_mentioned"": ""Coursiv"", ""sentiment"": ""recommended"", ""verbatim_quote"": ""Great intro to AI. Sometimes wish it would go a little deeper or frame the use case better, but great for 1st time intro to get a feel for capabilities and limitations of various AI tools.""}]","A first-time AI learner praises Coursiv as an accessible entry point but signals unmet depth needs, suggesting the product wins on approachability yet risks losing users who quickly outgrow introductory framing."
76,google_play,Coursiv,1,2026-03-01 18:18:50,tried canceling 2x and still getting billed for an app I dont use! $62/month canadian is extremely high for what Ai will just teach you anyway! edit. they also seem to be refusing to reimburse me for these months. this course is so boring and useless. DO NOT BUY THIS PROGRAM. I wish I had read the c,unclear,abandonment_regret,unclear,tried canceling 2x and still getting billed for an app I dont use | $62/month canadian is extremely high for what Ai will just teach you anyway | they also seem to be refusing to reimburse me for these months | this course is so boring and useless | DO NOT BUY THIS PROGRAM | I wish I had read the comments before purchasing to understand so many people are dealing with the same situation | terrible app and company,,"[{""product_mentioned"": ""Coursiv"", ""sentiment"": ""complained_about"", ""verbatim_quote"": ""tried canceling 2x and still getting billed for an app I dont use! $62/month canadian is extremely high for what Ai will just teach you anyway! edit. they also seem to be refusing to reimburse me for these months. this course is so boring and useless. DO NOT BUY THIS PROGRAM.""}]","This 1-star review signals a serious trust and retention crisis for Coursiv, with the user citing predatory billing practices, failed cancellation attempts, refusal to reimburse, and low content quality, while also implying the product is redundant given free AI tools — making it a strong competitive intelligence signal around churn, pricing credibility, and cancellation friction."
77,google_play,Coursiv,1,2026-03-26 08:39:15,great app but they hide the fact that if you pay $20 for the course you then have to pay $49 to unlock the Ai tools which they don't mention before you buy it. l didn't like that otherwise would have given them 5 stars ✨️,unclear,general_feedback,unclear,they hide the fact that if you pay $20 for the course you then have to pay $49 to unlock the Ai tools which they don't mention before you buy it,,"[{""product_mentioned"": ""Coursiv"", ""sentiment"": ""complained_about"", ""verbatim_quote"": ""great app but they hide the fact that if you pay $20 for the course you then have to pay $49 to unlock the Ai tools which they don't mention before you buy it""}]","This 1-star review reveals a critical pricing transparency issue with Coursiv — users feel deceived by an undisclosed upsell from a $20 course purchase to an additional $49 paywall to access AI tools, suggesting the onboarding and purchase flow fails to set clear expectations and risks high churn and negative word-of-mouth despite underlying product satisfaction."
78,google_play,Coursiv,5,2026-02-26 03:00:49,"The lessons on how to use AI has helped me tremendously they are so much easier and user friendly than I could have imagined. They make it easy to understand for the average person. I'm in my middle 60s and I thought it would be hard for me to catch and comprehend, but not so it's very helpful and I",career_switcher_45_plus,success_story,unclear,I thought it would be hard for me to catch and comprehend,The lessons on how to use AI has helped me tremendously | They make it easy to understand for the average person | it's very helpful and I can see myself using AI more and more,"[{""product_mentioned"": ""Coursiv"", ""sentiment"": ""recommended"", ""verbatim_quote"": ""The lessons on how to use AI has helped me tremendously they are so much easier and user friendly than I could have imagined.""}]","A reviewer in their mid-60s who expected AI learning to be inaccessible confirms Coursiv lowered the barrier to entry through user-friendly, jargon-free lessons, signaling strong product-market fit with older, non-technical adult learners."
79,google_play,Coursiv,5,2026-02-13 06:46:47,"Very easy to use and the information feels very accurate and helpful. Just make sure to pay attention to the questions it asks and the answers you give, because you're allowed to guess until you get it right, making it possible to rush through it without learning. Just remember not to cheat yourself",unclear,course_recommendation,unclear,,Very easy to use and the information feels very accurate and helpful.,"[{""product_mentioned"": ""Coursiv"", ""sentiment"": ""recommended"", ""verbatim_quote"": ""Very easy to use and the information feels very accurate and helpful.""}]","This 5-star review recommends Coursiv for ease of use and accuracy, but warns that the guess-until-correct quiz mechanic enables passive completion without genuine learning, signaling a product engagement risk that may undermine retention and perceived value."
80,google_play,Coursiv,5,2026-02-08 07:14:24,"Seems easy but if you want the right info in the right order without missing details and starting all over again each time, take this course and when you read, make sure you understand what your reading just like when in school, or your grade will reflect the same.",absolute_beginner_curious_explorer,course_recommendation,unclear,if you want the right info in the right order without missing details and starting all over again each time,"take this course and when you read, make sure you understand what your reading just like when in school","[{""product_mentioned"": ""Coursiv"", ""sentiment"": ""recommended"", ""verbatim_quote"": ""take this course""}]","This 5-star Coursiv review signals that the reviewer values structured, sequential learning to avoid confusion and repetition, suggesting a beginner audience that has previously struggled with disorganized or incomplete learning experiences and needs guided, step-by-step instruction."
