keyword,ad_count,avg_days,competitors,top_ad
college counselor affordable,4,17,", collegehubkz",Жми кнопку подробнее и получи бесплатную консультацию
college admissions help,2,10,", collegehubkz",Жми кнопку подробнее и получи бесплатную консультацию
Edvoy study abroad,5,8,", KaplanPathways, Study in the USA","Самое время записаться на консультацию в Study In, чтобы уже в 2024 году поехать учиться за рубеж!"
study abroad scholarship,5,8,", KaplanPathways, Study in the USA","Самое время записаться на консультацию в Study In, чтобы уже в 2024 году поехать учиться за рубеж!"
international student university guidance,13,5,", ""BІOГЛАЗ"" opтaлығы, Doro.Kazakhstan, EWA English Language Learning, James Cook University, KIMEP University, KaplanPathways, SHIPA MED, caspian.university, university23","Caspian University - место, где за 4 года ты обретешь образование, навыки, друзей, нетворкинг,  опыт"
how to apply US university,8,4,"James Cook University, KIMEP University, KaplanPathways, Queen Mary University of London, caspian.university, university23",Study at a UK university!
US college application,1,1,ShowMe,"It is a very practical software, click on the link to download it."
